id_str,created_at,full_text,truncated,user.screen_name,user.followers_count,user.friends_count,retweeted
1280684541619974144,2020-07-08 02:06:03+00:00,"Rehan Staton, a college graduate from Maryland, has been admitted to Harvard Law after continued adversity nearly made him abandon school altogether. He credits his time as a sanitation worker with helping him see his potential. https://t.co/m2t3E6wpoq",False,CNN,48997537,1109,False
1280683481756991488,2020-07-08 02:01:50+00:00,"A man was shot dead while walking and holding his 6-year-old daughter's hand in the Bronx, police say https://t.co/U9ClFHgcRR",False,CNN,48997537,1109,False
1280678952080736256,2020-07-08 01:43:50+00:00,"President Trump's niece claims in her book that Trump paid someone to take the SAT tests for him to help him get into the University of Pennsylvania. White House deputy press secretary Sarah Matthews said the allegation was ""absurd"" and ""completely false."" https://t.co/cRrLUfeWGb",False,CNN,48997537,1109,False
1280678511829823488,2020-07-08 01:42:05+00:00,"You might be forgiven for assuming US President Trump and Mexican President Andrés Manuel López Obrador wouldn't get along. But when they meet to celebrate the implementation of the USMCA trade deal, expect smiles all around. | Analysis by @MattRiversCNN https://t.co/EKdCrPOCgX",False,CNN,48997537,1109,False
1280678005896085506,2020-07-08 01:40:05+00:00,"Atlanta Mayor Keisha Lance Bottoms said Tuesday the increase in shootings and murders in the city and across the country is the result of a ""perfect storm"" of frustration, the coronavirus pandemic and issues with police brutality https://t.co/xpXXa37jkl",False,CNN,48997537,1109,False
1280677508984299520,2020-07-08 01:38:06+00:00,"""The meeting we just left was a disappointment.""

Civil rights and activist groups blasted Facebook's leadership after meeting with CEO Mark Zuckerberg and other execs to discuss the demands of an advertiser boycott that now includes hundreds of brands. https://t.co/FQCoAtFCYG",False,CNN,48997537,1109,False
1280675994337259520,2020-07-08 01:32:05+00:00,Walt Disney World Resort in Orlando remains on track for a phased reopening on July 11 even as Florida faces a spike of reported Covid-19 cases recently. Here's a quick look at where things stand. https://t.co/E5ZOGHUG2O,False,CNN,48997537,1109,False
1280675263165214720,2020-07-08 01:29:11+00:00,"Chinese hackers have moved to target US pharmaceutical and research institutions making progress against Covid-19, FBI Director Christopher Wray said in a speech that included some of the agency's starkest accusations about China's threat to the US to date https://t.co/zOft6TRqGp",False,CNN,48997537,1109,False
1280671898108600321,2020-07-08 01:15:48+00:00,"Democratic Sen. Tammy Duckworth, a US Army veteran who lost both of her legs while serving in Iraq, rebuked Tucker Carlson after the conservative Fox News host attacked her on Monday night and suggested that she hates America https://t.co/6rOlbhJLtJ",False,CNN,48997537,1109,False
1280669234968887297,2020-07-08 01:05:13+00:00,"The Movement for Black Lives, a coalition of 150 Black organizations, has announced a sweeping legislative proposal to reform policing and address systemic racism — with a more progressive approach than the legislation House Democrats approved last month https://t.co/0k3Jh4T77j",False,CNN,48997537,1109,False
1280667367438053376,2020-07-08 00:57:48+00:00,"President Trump also claimed that the US is ""not closing"" and will ""never close,"" even as the most recent coronavirus data from Johns Hopkins University show that at least 32 states are reporting higher rates of new cases this week compared to last week. https://t.co/5t2gZHafvX",False,CNN,48997537,1109,False
1280666643023237122,2020-07-08 00:54:55+00:00,"""We're very much going to put pressure on governors and everybody else to open the schools, to get them open,"" said Pres. Trump, who has been anxious to reopen America to kickstart the economy and otherwise move on from the pandemic, despite its resurgence https://t.co/ox5tWWxvDg",False,CNN,48997537,1109,False
1280665615527747584,2020-07-08 00:50:51+00:00,A newly discovered comet dubbed NEOWISE will be visible this week to the naked eye. It's the first visible comet of 2020. https://t.co/aF8GAEsuz1,False,CNN,48997537,1109,False
1280662452678594561,2020-07-08 00:38:16+00:00,The coronavirus crisis has made naturalization ceremonies in the US look a little different https://t.co/lM1ONK15PH,False,CNN,48997537,1109,False
1280659993386197006,2020-07-08 00:28:30+00:00,"""The college experience in America might never look the same. Covid-19 is threatening to upend the models that both public and private higher education depend on in the United States,"" write Charles A. Goldman and Rita T. Karam | Perspectives https://t.co/wU5yntmWKm",False,CNN,48997537,1109,False
1280657635059085312,2020-07-08 00:19:08+00:00,"In a video posted online over the weekend, President Trump's first national security adviser, Michael Flynn, is seen using phrases and slogans that are hallmarks of the baseless QAnon conspiracy movement. He also tagged his post with a QAnon hashtag. https://t.co/CHJXDLNMFP",False,CNN,48997537,1109,False
1280655141679529986,2020-07-08 00:09:13+00:00,"Gallup's new poll on President Trump's political standing shows:

1) Reigniting a culture war over calls to remove monuments has rallied his political base
2) That decision has further alienated independents and other swing voters

Analysis by @CillizzaCNN https://t.co/BEzEoiW4I5",False,CNN,48997537,1109,False
1280652641463394304,2020-07-07 23:59:17+00:00,"A Muslim woman has filed a discrimination charge against Target after she said she received a drink from a Target Starbucks barista with ""ISIS"" written on the cup instead of her name https://t.co/p1FLBifCxR",False,CNN,48997537,1109,False
1280649336809050113,2020-07-07 23:46:09+00:00,"Mary Trump, President Trump's niece, reveals in her forthcoming tell-all book that she was a source for The New York Times' Pulitzer Prize-winning story about the President's tax returns https://t.co/LL3iu4XTnA",False,CNN,48997537,1109,False
1280646934278164480,2020-07-07 23:36:37+00:00,"A man was driving down the highway when he saw an eastern brown snake in his vehicle — a highly venomous reptile responsible for the majority of snakebite deaths in Australia.

He used a seat belt and a knife to fight it off while trying to stop the car. https://t.co/MMGkuEY6cc",False,CNN,48997537,1109,False
1280644430589038592,2020-07-07 23:26:40+00:00,"Major League Baseball's 2020 season is set to begin on July 23 with a pair of games.

Every team will play a 60-game schedule entirely against teams in their own geographic region to limit travel. https://t.co/LcBi18aLzu",False,CNN,48997537,1109,False
1280641558606426112,2020-07-07 23:15:15+00:00,"The European Commission said it expects the EU economy will contract more sharply this year and take longer to recover from the coronavirus pandemic than previously expected, piling pressure on leaders to finalize plans for a huge recovery package https://t.co/CYWV2zMm9C",False,CNN,48997537,1109,False
1280639110416404480,2020-07-07 23:05:31+00:00,"With the surge in Covid-19 cases and signs of a drop in bookings, airlines that added flights may have gotten ahead of themselves. They could soon be flying mostly empty planes and running up losses once again. https://t.co/yxWemfjnLG",False,CNN,48997537,1109,False
1280636543405826051,2020-07-07 22:55:19+00:00,The US Food and Drug Administration has added five hand sanitizers to its list of products that have tested positive for a toxic chemical https://t.co/DEBVQFyP8U,False,CNN,48997537,1109,False
1280632540915695616,2020-07-07 22:39:25+00:00,"People with no obvious symptoms of Covid-19 ⁠— called ""silent spreaders"" ⁠— may be responsible for half of the Covid-19 cases in the US, a new study has found https://t.co/mILTTcqbpy",False,CNN,48997537,1109,False
1280630050358951936,2020-07-07 22:29:31+00:00,"Mary Trump, the President's niece, writes that Trump ""destroyed my father. I can't let him destroy my country,"" in a new book obtained by CNN. https://t.co/6UJwcheIC9",False,CNN,48997537,1109,False
1280628659469025280,2020-07-07 22:24:00+00:00,"In her new book, President Trump's niece — a clinical psychologist — delves into the President's family history and makes devastating claims about his mental state. #TheDailyDC podcast breaks down what the book means for the presidency and 2020 campaign. https://t.co/UaMBMgx6O1 https://t.co/MiAALRX65W",False,CNN,48997537,1109,False
1280625809099755524,2020-07-07 22:12:40+00:00,"The East Wing is bracing for an upcoming book by a former Melania Trump aide, a source says.

Stephanie Winston Wolkoff's ""Melania and Me"" bookends a summer of dishy Trump-related memoirs, including those from John Bolton and Mary Trump. https://t.co/2RA9t3lCdJ",False,CNN,48997537,1109,False
1280623473623207938,2020-07-07 22:03:23+00:00,"""No one should be protecting the legacies of confederate leaders and slave owners.""

Justin Timberlake has become the latest public figure to call for the removal of Confederate monuments across the US. https://t.co/UYh2SHZ17d",False,CNN,48997537,1109,False
1280619551403790344,2020-07-07 21:47:48+00:00,"Michigan Gov. Gretchen Whitmer called for a ""national mask-up campaign,"" saying it is necessary for everyone, even those in the White House, to wear masks to stem the spread of coronavirus as the number of cases surge across the US https://t.co/mm5JUpkcCc",False,CNN,48997537,1109,False
1280615111003189251,2020-07-07 21:30:09+00:00,"Great Big Story is a podcast for the curious, made by the curious. We scour the globe in search of the delightful, surprising, jaw-droppingly awesome stories all around.
 
Listen 🎧 : https://t.co/1tstPAz5vi https://t.co/f90oDFYpHv",False,CNN,48997537,1109,False
1280612551924031488,2020-07-07 21:19:59+00:00,"Mississippi Lt. Gov. Delbert Hosemann's staff said he has tested positive for Covid-19, a CNN affiliate reports https://t.co/w6Imms4vHx",False,CNN,48997537,1109,False
1280610199359950853,2020-07-07 21:10:38+00:00,"Two of Thomas Jefferson's descendants are calling for his memorial to be replaced.

One, who is White, is a sixth-generation descendant. The other, who is Black, is a ninth-generation descendant of Jefferson and one of his slaves. https://t.co/qfpUFx8RWx",False,CNN,48997537,1109,False
1280607439969280004,2020-07-07 20:59:40+00:00,"The University of Washington has extended its projection of US coronavirus deaths, predicting at least 208,255 deaths by November 1.

But if 95% of the population wears a mask in public, that number would drop to approximately 162,808, the model finds. https://t.co/iVBBwRic1a",False,CNN,48997537,1109,False
1280606250888310784,2020-07-07 20:54:57+00:00,"President Trump said the US is “not closing, we’ll never close,” as he once again pushed the country to fully reopen.

Several states have paused or rolled back reopening plans as Covid-19 cases continue to rise. https://t.co/yZveeTRraY",False,CNN,48997537,1109,False
1280603130732990465,2020-07-07 20:42:33+00:00,"Facts First: While US coronavirus mortality rates have declined recently, they are not the lowest in the world. https://t.co/sB2TeBBJNz",False,CNN,48997537,1109,False
1280600053762215937,2020-07-07 20:30:19+00:00,"A woman out for a run in St. Petersburg, Florida, came across a decomposing human head on the side of the road on Tuesday, according to police. ""We are asking the public if they saw anything suspicious, to let us know."" https://t.co/XPMi60l7lm",False,CNN,48997537,1109,False
1280597757808558083,2020-07-07 20:21:12+00:00,"The Trump administration has notified Congress and the United Nations that the United States is formally withdrawing from the World Health Organization, multiple officials tell CNN https://t.co/pMdEUHtPKx",False,CNN,48997537,1109,False
1280597610571526145,2020-07-07 20:20:37+00:00,"One of the units also contained a dental chair, with straps for feet and arms. https://t.co/HfFA7HG75N",False,CNN,48997537,1109,False
1280597070248734720,2020-07-07 20:18:28+00:00,"Officers arrested six men suspected of kidnapping and hostage-taking.

They found six shipping containers which had been converted to what are believed to be ""prison cells,"" as well as a stash of weaponry including pruning shears and loppers. https://t.co/Ad6LWTHBRx",False,CNN,48997537,1109,False
1280595397459824647,2020-07-07 20:11:49+00:00,"An apparent torture site was hidden inside shipping containers, which were lined with sound-proofing material and filled with assumed torture devices, authorities say.

Encrypted chat network EncroChat was accessed to track suspects' movements and plans. https://t.co/wNKtVVKj0w",False,CNN,48997537,1109,False
1280592458846535685,2020-07-07 20:00:09+00:00,"Amid all of the grilling and fireworks, you may have missed a development that could fundamentally impact the fight for the Senate majority this fall: Amy McGrath beat Charles Booker to win the Kentucky Democratic primary | Analysis by @CillizzaCNN https://t.co/IOz3Groraf",False,CNN,48997537,1109,False
1280585475405877248,2020-07-07 19:32:24+00:00,"The American economy's unprecedented jobs rebound masks a difficult truth: For millions of people, the jobs they lost are never coming back. https://t.co/Uw5M6ytl39",False,CNN,48997537,1109,False
1280581400559788032,2020-07-07 19:16:12+00:00,"""Operation Warp Speed,"" the federal government's Covid-19 vaccine program, has announced the largest government Covid-19 vaccine contract to date — a $1.6 billion contract with Novavax, a Maryland biotech company. https://t.co/W0P7H1j09b",False,CNN,48997537,1109,False
1280577366356615168,2020-07-07 19:00:10+00:00,"Tuesday is #BlackOutDay2020, when many Black Americans plan to showcase their combined economic might by not spending any money. Those who have to buy something are being encouraged to spend their money at a Black-owned business. https://t.co/B6865NBkGu",False,CNN,48997537,1109,False
1280576093649600512,2020-07-07 18:55:07+00:00,"Major League Soccer's MLS is Back Tournament match between Nashville SC and Chicago Fire FC has been postponed, the league announced in a statement Tuesday. https://t.co/mzxt3G5N7y",False,CNN,48997537,1109,False
1280574815951294464,2020-07-07 18:50:02+00:00,Schools in Hong Kong have been told that they must remove books and teaching materials that could violate the sweeping national security law that was imposed by Beijing last week https://t.co/AyiNmGww80,False,CNN,48997537,1109,False
1280572754668875781,2020-07-07 18:41:51+00:00,"“I will not reopen our school system August 24th if the conditions are what they are today,” Miami-Dade County Public Schools Superintendent Alberto Carvalho says. “Our reopening plan contemplates a phase two reality. We are still in phase one.” https://t.co/BBpiUNVWhm https://t.co/sj2nPQJqMc",False,CNN,48997537,1109,False
1280572311624716288,2020-07-07 18:40:05+00:00,"Mary Trump, the President's niece, writes that Trump ""destroyed my father. I can't let him destroy my country,"" in new book obtained by CNN. https://t.co/cYzcQujrTu",False,CNN,48997537,1109,False
1280570547705962496,2020-07-07 18:33:05+00:00,"Two months after contracting Covid-19, CNN anchor @richardquest is still experiencing the long tail of the virus, including a recurrent cough, serious fatigue and unexplained clumsiness. https://t.co/rg4a7QHWpW",False,CNN,48997537,1109,False
1280569291969114115,2020-07-07 18:28:05+00:00,"The Trump administration has notified Congress that it is formally withdrawing the United States from the World Health Organization amid the coronavirus pandemic, multiple officials tell CNN https://t.co/oQMLEH3bhk",False,CNN,48997537,1109,False
1280567295329402881,2020-07-07 18:20:09+00:00,"The US Environmental Protection Agency says Lysol Disinfectant Spray and Lysol Disinfectant Max Cover Mist are effective against coronavirus when used on hard, non-porous surfaces. https://t.co/7RIkE1XR4N",False,CNN,48997537,1109,False
1280564750926127104,2020-07-07 18:10:03+00:00,Brazilian President Bolsonaro has tested positive for Covid-19. He has downplayed the pandemic and often skips wearing a mask. https://t.co/nugtAnt0Of,False,CNN,48997537,1109,False
1280563515279970307,2020-07-07 18:05:08+00:00,"Ringo Starr turns 80 years old today. He became a household name as the drummer of the Beatles, one of the most iconic bands of all time. https://t.co/am9Nhmn5ct https://t.co/H5o8RooBzm",False,CNN,48997537,1109,False
1280562275515015170,2020-07-07 18:00:12+00:00,"Black-owned small businesses often are more vulnerable financially than others, with smaller cash reserves to survive tough times. Here are a few ways to help support them. https://t.co/h0CgWcxjnY",False,CNN,48997537,1109,False
1280561236103618560,2020-07-07 17:56:05+00:00,"New York regulators say Deutsche Bank's ""significant compliance failures"" allowed accused sex-trafficker Jeffrey Epstein to conduct hundreds of transactions totaling millions of dollars that should have prompted additional scrutiny. https://t.co/43G438SWdk",False,CNN,48997537,1109,False
1280560105747099648,2020-07-07 17:51:35+00:00,"Rehan Staton, a college graduate from Maryland, has been admitted to Harvard Law after continued adversity nearly made him abandon school altogether. He credits his time as a sanitation worker with helping him see his potential. https://t.co/YbDqC022H8",False,CNN,48997537,1109,False
1280555135551377409,2020-07-07 17:31:50+00:00,"Were you called back to work but then laid off or furloughed again as the coronavirus forces new shutdowns? Did you return to your job but are now afraid of going to work?

You can share your story with @CNNBusiness. https://t.co/tIBc56QGRS",False,CNN,48997537,1109,False
1280551690169655304,2020-07-07 17:18:09+00:00,"Black and White descendants of Thomas Jefferson are calling for monuments of him to be removed.

“A lot of these public statues were put in place for the wrong reasons … We have to start looking at these people as human beings, not gods, not idols,” Shannon LaNier says. https://t.co/9sIx0mx5Mk",False,CNN,48997537,1109,False
1280545962872750081,2020-07-07 16:55:23+00:00,"The use of paper currencies was declining before Covid-19 hit, according to the Federal Reserve Bank of San Francisco. The pandemic has accelerated the demise of cash due to infection concerns — and that's great news for Square and Venmo owner PayPal. https://t.co/rYW6SQiv89",False,CNN,48997537,1109,False
1280542118029799424,2020-07-07 16:40:06+00:00,"Tuesday is #BlackOutDay2020, when many Black Americans plan to showcase their combined economic might by not spending any money. Those who have to buy something are being encouraged to spend their money at a Black-owned business. https://t.co/5SAgzg7sWU",False,CNN,48997537,1109,False
1280539602567204864,2020-07-07 16:30:07+00:00,"Mary Trump, the President's niece, writes that Trump ""destroyed my father. I can't let him destroy my country,"" in new book obtained by CNN. https://t.co/I7ZoKBw8MD",False,CNN,48997537,1109,False
1280537077558456320,2020-07-07 16:20:05+00:00,"Forty-three hospital ICUs in 21 Florida counties have hit capacity and show zero beds available, according to the latest data. Follow live updates: https://t.co/qVH7ftVIgc",False,CNN,48997537,1109,False
1280534568836255746,2020-07-07 16:10:07+00:00,"Authorities in the Chinese region of Inner Mongolia are on high alert after a suspected case of bubonic plague, the disease that caused the Black Death pandemic, was reported Sunday. https://t.co/7O1cDyy9gm",False,CNN,48997537,1109,False
1280534540222693377,2020-07-07 16:10:00+00:00,"Contact tracers will never ask you for your personal financial information or request a payment. Today on ""Coronavirus: Fact vs Fiction,"" @drsanjaygupta explains how to work with real contract tracing divisions without getting scammed by the impersonators.
https://t.co/CSB7GQyrgq",False,CNN,48997537,1109,False
1280532089973149696,2020-07-07 16:00:16+00:00,"Refusing to wear a face mask during the Covid-19 pandemic should be as socially unacceptable as drunk-driving or driving without using a seat belt, a UK science official says. https://t.co/9CLv3Sx3a5",False,CNN,48997537,1109,False
1280529532550893569,2020-07-07 15:50:06+00:00,"Phoenix police officers shot and killed a man inside a parked car July 4 in an incident captured on bystander video, sparking renewed protests in the Arizona city https://t.co/jS0be3BDqG",False,CNN,48997537,1109,False
1280527511575769088,2020-07-07 15:42:04+00:00,"😷 Wash your hands.
😷 Put on a clean cloth mask, holding it by the ear loops.
😷 Cover your nose, mouth &amp; chin.
😷 Take off the mask by the ear loops.
😷 Wash or store it in a clean, resealable plastic bag right away.
😷 Wash your hands again. https://t.co/BTTi8En767",False,CNN,48997537,1109,False
1280526065446858755,2020-07-07 15:36:19+00:00,JUST IN: Brazilian President Bolsonaro tests positive for Covid-19. He has downplayed the pandemic and often skips wearing a mask. https://t.co/ANRne36krj,False,CNN,48997537,1109,False
1280524542256046081,2020-07-07 15:30:16+00:00,"At the heart of the CIA headquarters, there’s a secret message hidden in a sculpture that’s stumped code breakers for over 30 years. 
 
Where did it come from, and what makes it uncrackable? Find out on Great Big Story, our new podcast. https://t.co/I3ZxIuMlN2 https://t.co/rYbgc0XfG1",False,CNN,48997537,1109,False
1280521992169558016,2020-07-07 15:20:08+00:00,"The United States is ""looking at"" banning Chinese social media apps, including TikTok, Secretary of State Mike Pompeo said Monday. https://t.co/gJXKbiDC4s",False,CNN,48997537,1109,False
1280519467777306632,2020-07-07 15:10:06+00:00,"Illinois Sen. Tammy Duckworth, who is Thai-American, passed when CNN's Dana Bash asked her whether Joe Biden should pick a Black woman as his running mate, saying he ""knows best"" about what he needs and that it isn't on ""any of us to dictate to him."" https://t.co/LTMf5lJmb3",False,CNN,48997537,1109,False
1280518365652623360,2020-07-07 15:05:43+00:00,"Experts say closing the Black-White wealth gap will require strategic policy changes. The same was true before Covid-19.

“At some point, you need an infusion of stimulus and an infusion of cash,” said Andre Perry, a fellow at the Brookings Institution. https://t.co/A57yXoyYnp",False,CNN,48997537,1109,False
1280517950328496130,2020-07-07 15:04:04+00:00,"Nana Prempeh, who recently graduated from high school, decided to attend a community college in New Jersey in the fall rather than a four-year university to reduce costs during the uncertain economy. https://t.co/A57yXoyYnp https://t.co/3nhICbaqCP",False,CNN,48997537,1109,False
1280517703594381315,2020-07-07 15:03:06+00:00,"Student debt can also limit Black students' decisions about their futures.

At graduation, Black college students owe an average of  $23,400 in loans, versus $16,000 for their  White peers, according to Brookings, a nonpartisan think-tank. https://t.co/A57yXoyYnp https://t.co/2CZy7EQ0Fo",False,CNN,48997537,1109,False
1280517479261966342,2020-07-07 15:02:12+00:00,"Mamourou Kone planned to attend Nazereth College in Rochester, New York, in the fall, but he may stay closer to home if he can't find a job in Rochester. https://t.co/A57yXoyYnp https://t.co/WgdYnDHkze",False,CNN,48997537,1109,False
1280517269936799744,2020-07-07 15:01:22+00:00,"Four months ago, Gen Z was enjoying the strongest labor market in 50 years. It disappeared within weeks when Covid-19 hit.

Now youth unemployment is at devastating highs. At 27.7% it's even worse for Black Americans, ages 16 to 24, than their White peers. https://t.co/A57yXoyYnp https://t.co/ilrEtAONwp",False,CNN,48997537,1109,False
1280516923915108353,2020-07-07 15:00:00+00:00,"Adraint Bereal graduated from the University of Texas at Austin in May with his BFA in design. He was set to start an internship at an ad agency in New York this summer, but his offer was rescinded due to Covid-19. https://t.co/A57yXoyYnp https://t.co/8WyVWBsG6o",False,CNN,48997537,1109,False
1280516706067243015,2020-07-07 14:59:08+00:00,"Before Covid-19, Gen Z offered the prospect that inequality in the US might finally narrow, at least by some measures. Now those hopes are dimming as economists expect that youth will suffer the greatest pandemic-related economic setbacks among US workers. https://t.co/CbjUgxVuyk",False,CNN,48997537,1109,False
1280513162102571016,2020-07-07 14:45:03+00:00,Australia has closed its inter-state border between Victoria and New South Wales — the country's two most populous states — as it battles Covid-19. It hasn't been closed since the Spanish flu pandemic a century ago. https://t.co/LUQjGWVpMi,False,CNN,48997537,1109,False
1280512038087819273,2020-07-07 14:40:35+00:00,"Refusing to wear a face mask during the Covid-19 pandemic should be as socially unacceptable as drunk-driving or driving without using a seat belt, a UK science official says. https://t.co/G2DP7huuA0",False,CNN,48997537,1109,False
1280509403758813191,2020-07-07 14:30:07+00:00,"How do you start the difficult conversations needed right now? @WKamauBell leads the way on an all-new season of #UnitedShades, starting Sunday, July 19th at 10 p.m. ET https://t.co/lM8CGPQxAN",False,CNN,48997537,1109,False
1280509152079593480,2020-07-07 14:29:07+00:00,"The US Environmental Protection Agency says Lysol Disinfectant Spray and Lysol Disinfectant Max Cover Mist are effective against coronavirus when used on hard, non-porous surfaces. https://t.co/AUcBgtbIns",False,CNN,48997537,1109,False
