id_str,created_at,full_text,truncated,user.screen_name,user.followers_count,user.friends_count,retweeted
1282290887830249479,2020-07-12 12:29:06+00:00,"Refusing to wear a face mask during the Covid-19 pandemic should be as socially unacceptable as drunk-driving or driving without using a seat belt, a UK science official says. https://t.co/bklSBfOJRm",False,CNN,48997531,1109,False
1282283841097469954,2020-07-12 12:01:06+00:00,"A Japanese baseball team temporarily replaced fans with dancing robots. More than 20 ""Spot"" and ""Pepper"" robots showed off their moves for the team's fight song before a game this past week. https://t.co/5ZHGPGR1DQ https://t.co/EuLu0CVOTP",False,CNN,48997531,1109,False
1282276293388771330,2020-07-12 11:31:06+00:00,"Worldwide, Sikh temples, also known as Gurdwaras, offer free meals to anyone who shows up. Known as Langar, it's a tenet of faith and a key part of the Sikh religion, which emphasizes a concept of selfless service to the community at large. https://t.co/PrnS6bIGvq",False,CNN,48997531,1109,False
1282268467920502784,2020-07-12 11:00:00+00:00,New York City paints a Black Lives Matter mural on the street directly outside of Trump Tower in Midtown Manhattan https://t.co/RWtjvTfadh https://t.co/U8Uh6rhMyB,False,CNN,48997531,1109,False
1282261196801024000,2020-07-12 10:31:07+00:00,"""Physicians need to think of COVID-19 as a multisystem disease."" Coronavirus damages not only the lungs, but the kidneys, liver, heart, brain and nervous system, skin and gastrointestinal tract, doctors say in a review of reports about Covid-19 patients. https://t.co/dMVfYONwGB",False,CNN,48997531,1109,False
1282253366173655040,2020-07-12 10:00:00+00:00,"With its engine behind the driver instead of under the hood, General Motors' 2020 Corvette Stringray represents a huge change for one of America's most famous cars. https://t.co/2ooFfo03uk https://t.co/wvnFjvvThV",False,CNN,48997531,1109,False
1282242308667322368,2020-07-12 09:16:03+00:00,"Spain's large-scale study on the coronavirus indicates just 5% of its population has developed antibodies, strengthening evidence that so-called herd immunity to Covid-19 is ""unachievable,"" the medical journal the Lancet reported https://t.co/wnqTu4nWns",False,CNN,48997531,1109,False
1282238268289892352,2020-07-12 09:00:00+00:00,"Bill Nye the Science Guy took to TikTok to demonstrate why the general public should wear masks, conducting a series of experiments to show how different kinds of face coverings work. https://t.co/psuBEXQ2Yj https://t.co/e5WhCmDskE",False,CNN,48997531,1109,False
1282223168564809728,2020-07-12 08:00:00+00:00,South Korea's government used hundreds of drones for a spectacular display to thank frontline workers and encourage wearing masks and social distancing https://t.co/WIiyG4bTlm https://t.co/6NReRaTpa5,False,CNN,48997531,1109,False
1282215628942737408,2020-07-12 07:30:03+00:00,"Refusing to wear a face mask during the Covid-19 pandemic should be as socially unacceptable as drunk-driving or driving without using a seat belt, a UK science official says. https://t.co/koeGKgyNAO",False,CNN,48997531,1109,False
1282208068600643584,2020-07-12 07:00:00+00:00,"Aerial refueling is a challenging but critical operation for modern air forces around the world, but has actually been around since the early days of aviation. https://t.co/O9joa3KhEH https://t.co/coY9g9nXiw",False,CNN,48997531,1109,False
1282200286275276802,2020-07-12 06:29:05+00:00,"😷 Wash your hands.
😷 Put on a clean cloth mask, holding it by the ear loops.
😷 Cover your nose, mouth &amp; chin.
😷 Take off the mask by the ear loops.
😷 Wash or store it in a clean, resealable plastic bag right away.
😷 Wash your hands again. https://t.co/EgyADUXzZc",False,CNN,48997531,1109,False
1282192968196259842,2020-07-12 06:00:00+00:00,"Millions of young adults moved back in with their parents in March and April, as layoffs hit their incomes and lockdowns made urban apartments feel crunched. @ClareCNN reports on how that shift could have a long-term impact on the real estate industry. https://t.co/rUiMRpSiMK https://t.co/YOMjNZ5MpA",False,CNN,48997531,1109,False
1282185684841836545,2020-07-12 05:31:03+00:00,"Mary Trump, the President's niece, writes that Trump ""destroyed my father. I can't let him destroy my country,"" in new book obtained by CNN. https://t.co/I5BUINy9Ju",False,CNN,48997531,1109,False
1282177868718432256,2020-07-12 05:00:00+00:00,"From Germany to Coney Island, here's a history lesson on one of America's favorite summertime foods: the hot dog. https://t.co/TKCZ5Pnf1q https://t.co/LPNPK4Xb9W",False,CNN,48997531,1109,False
1282170093477212160,2020-07-12 04:29:06+00:00,"A Muslim woman has filed a discrimination charge against Target after she said she received a drink from a Target Starbucks barista with ""ISIS"" written on the cup instead of her name https://t.co/jl4bPoTAlX",False,CNN,48997531,1109,False
1282166809660203008,2020-07-12 04:16:03+00:00,"Authorities in the Netherlands have discovered an apparent torture site hidden inside shipping containers, which were lined with sound-proofing material and filled with assumed torture devices, the country's National Prosecutor's Office has said https://t.co/rhtw6pFZgK",False,CNN,48997531,1109,False
1282163043699494918,2020-07-12 04:01:05+00:00,"After 2 weeks in New York, Dr. Hartwell Lin came back to his colleagues with first-hand knowledge of how to handle a Covid-19 outbreak -- and, perhaps most importantly, he returned as a living testament to the effectiveness of personal protective equipment https://t.co/B7j8bx77mN",False,CNN,48997531,1109,False
1282162769329037315,2020-07-12 04:00:00+00:00,"MIT has designed a robot that is capable of disinfecting the floor of a 4,000-square foot warehouse in only half an hour, and it could one day be used to clean your local grocery store or school. https://t.co/1jubSl7QiN https://t.co/33eTqyAOw2",False,CNN,48997531,1109,False
1282155499333582848,2020-07-12 03:31:06+00:00,"Mary Trump, President Trump's niece, reveals in her forthcoming tell-all book that she was a source for The New York Times' Pulitzer Prize-winning story about the President's tax returns https://t.co/iQVTibfbXR",False,CNN,48997531,1109,False
1282151455206539265,2020-07-12 03:15:02+00:00,A Florida man and his three sons are facing criminal charges for allegedly selling a toxic solution to tens of thousands of people as a cure for Covid-19 https://t.co/Y45rcmHa4i,False,CNN,48997531,1109,False
1282147720061485059,2020-07-12 03:00:12+00:00,"When rock band Bon Jovi canceled its summer tour due to the global pandemic, frontman Jon Bon Jovi didn't waste a beat turning his focus to those in need in his own backyard https://t.co/rO9iYKrODy",False,CNN,48997531,1109,False
1282144157218349062,2020-07-12 02:46:02+00:00,"Many Latinos are angry at Goya Foods CEO Robert Unanue, and are sad and disappointed in him, too. His praise of Trump at a White House ceremony reflect how out of touch CEOs can be to their primary consumers, and to the national mood, writes Raul A. Reyes https://t.co/03w1fptE4P",False,CNN,48997531,1109,False
1282139639554420737,2020-07-12 02:28:05+00:00,"A statue of Melania Trump has been removed from near her hometown in Slovenia after being badly burned by vandals, the artist who commissioned the sculpture says. https://t.co/zUJTAJKtDw",False,CNN,48997531,1109,False
1282136357851336705,2020-07-12 02:15:03+00:00,"An angry announcement about  Roger Stone, one of Trump's earliest and most steadfast political allies, issued by the White House reflected the rage of an administration that is besieged and bewildered, writes Errol Louis via @CNNOpinion https://t.co/CS3kHC0skQ",False,CNN,48997531,1109,False
1282132612329414661,2020-07-12 02:00:10+00:00,"Worldwide, Sikh temples, also known as Gurdwaras, offer free meals to anyone who shows up. Known as Langar, it's a tenet of faith and a key part of the Sikh religion, which emphasizes a concept of selfless service to the community at large. https://t.co/0pdmppbwJ6",False,CNN,48997531,1109,False
1282128558014504964,2020-07-12 01:44:03+00:00,Here's a breakdown of 12 baseless claims from the White House statement on Roger Stone's commutation https://t.co/33JRnOrVVC,False,CNN,48997531,1109,False
1282124286501822464,2020-07-12 01:27:05+00:00,"Olympic sprinter Usain Bolt has given his newborn daughter a name worthy of a future champion.

Introducing Olympia Lightning Bolt ⚡⚡⚡ https://t.co/VFzEBWG30H https://t.co/fbCOWqOCp8",False,CNN,48997531,1109,False
1282121016442064896,2020-07-12 01:14:05+00:00,"Jada Pinkett Smith and Will Smith came together for a special edition of her ""Red Table Talk"" show on Facebook to share their side of the controversy surrounding her relationship with singer August Alsina. https://t.co/0dNyN3p03D",False,CNN,48997531,1109,False
1282117549447159808,2020-07-12 01:00:19+00:00,"Join Michael @Smerconish for an entertaining and poignant look at his one of a kind career. ""Things I Wish I Knew Before I Started Talking” airs tonight at 10 p.m. ET https://t.co/n8WFNz9u4u",False,CNN,48997531,1109,False
1282109433284362240,2020-07-12 00:28:03+00:00,"A White man and a White woman who allegedly painted over a California community's Black Lives Matter mural are each facing a hate crime charge, the Contra Costa County District Attorney's Office says https://t.co/BDNK2mKyfH",False,CNN,48997531,1109,False
1282106180094099463,2020-07-12 00:15:08+00:00,"The top writer for Fox News host Tucker Carlson has for years been using a pseudonym to post bigoted remarks on an online forum that is a hotbed for racist, sexist, and other offensive content, CNN Business learned this week https://t.co/U0Bf4YeRfl",False,CNN,48997531,1109,False
1282102426477252610,2020-07-12 00:00:13+00:00,"Experts at the University College London are the latest to describe that Covid-19 could cause neurological complications including stroke, nerve damage and potentially fatal brain inflammation — even if the patients didn't show severe respiratory symptoms. https://t.co/JDf7okRDDw",False,CNN,48997531,1109,False
1282097859647725570,2020-07-11 23:42:04+00:00,A bus driver in France who was beaten up by passengers refusing to wear mandatory face masks has died https://t.co/Yd5LkHF6T8,False,CNN,48997531,1109,False
1282093572402094080,2020-07-11 23:25:02+00:00,"It may soon be illegal to make discriminatory, racially biased 911 calls in San Francisco. https://t.co/mhPBsZo4la",False,CNN,48997531,1109,False
1282093463685738507,2020-07-11 23:24:36+00:00,This tweet replaces a previous tweet to correct a url and label this article as analysis.,False,CNN,48997531,1109,False
1282093230293692416,2020-07-11 23:23:40+00:00,"Analysis: In thumbing his nose at justice, President Trump continued turning a blind eye to the Americans for whom coronavirus has actually been a death sentence. https://t.co/F01hVRMKiw",False,CNN,48997531,1109,False
1282090063912935426,2020-07-11 23:11:05+00:00,"Instead of celebrating with free Slurpees on July 11 (7/11), 7-Eleven said it would celebrate its birthday by donating one million meals to Feeding America, a national nonprofit.
https://t.co/3nuHukcumi",False,CNN,48997531,1109,False
1282087316052467712,2020-07-11 23:00:10+00:00,"""Instead of a moral compass in the Oval Office, there's a moral vacuum. ... Our country is dangerously adrift. But this November, we can choose another direction,"" writes Robert Redford for @CNNOpinion https://t.co/ZQ7UkK15PC",False,CNN,48997531,1109,False
1282085520668069888,2020-07-11 22:53:02+00:00,"The reopening of schools is a goal and one that is going to require work, preparation, flexibility, and collective action to be executed safely, writes Dr. Edith Bracho-Sanchez https://t.co/YpF06QVdIQ",False,CNN,48997531,1109,False
1282083266485518336,2020-07-11 22:44:05+00:00,"House Speaker Nancy Pelosi blasts President Trump's Roger Stone commutation as ""an act of staggering corruption"" as Trump defends his decision https://t.co/CVQPb1ti3m https://t.co/wP2HRpRmAK",False,CNN,48997531,1109,False
1282079481180622849,2020-07-11 22:29:02+00:00,"Mary Trump, the President's niece, writes that Trump ""destroyed my father. I can't let him destroy my country,"" in a new book obtained by CNN. https://t.co/njfPp0sbNH",False,CNN,48997531,1109,False
1282075966370717700,2020-07-11 22:15:04+00:00,"Nearly 1.5 million teachers are at higher risk of serious illness if they contract coronavirus, report finds. https://t.co/SvQGNu55aB",False,CNN,48997531,1109,False
1282074191169302529,2020-07-11 22:08:01+00:00,"President Donald Trump paid a visit to wounded service members at Walter Reed National Military Medical Center and wore a mask, after months of refusing to be seen doing so in public. https://t.co/pm0WeR3Zg6",False,CNN,48997531,1109,False
1282072252331241473,2020-07-11 22:00:19+00:00,"Great Big Story is a podcast for the curious, made by the curious. We scour the globe in search of the delightful, surprising, jaw-droppingly awesome stories all around.
 
Listen 🎧 : https://t.co/8YGukk6TXP https://t.co/VXoSOmCbMI",False,CNN,48997531,1109,False
1282070429621014532,2020-07-11 21:53:04+00:00,The family of a 3-month-old girl is trying to raise over $2 million for a one-time gene therapy treatment that may be their daughter's only chance of surviving past her second birthday. https://t.co/mVccl4kBPU,False,CNN,48997531,1109,False
1282068408436240386,2020-07-11 21:45:02+00:00,"An anonymous buyer bid a record $114,000 for a rare, unopened copy of the classic video game Super Mario Bros. https://t.co/l6EYjLt1tR",False,CNN,48997531,1109,False
1282060886501396481,2020-07-11 21:15:09+00:00,"Join Michael @Smerconish for an entertaining and poignant look at his one of a kind career. ""Things I Wish I Knew Before I Started Talking” airs tonight at 10 p.m. ET https://t.co/DirMaxbS2S",False,CNN,48997531,1109,False
1282057104979787777,2020-07-11 21:00:07+00:00,"Internal documents from the US Centers for Disease Control and Prevention warned that fully reopening K-12 schools and universities would be the ""highest risk"" for the spread of coronavirus, according to a New York Times report https://t.co/Sk9vVKbT9i",False,CNN,48997531,1109,False
1282053318857154561,2020-07-11 20:45:05+00:00,"The data shows that more than 68% of people tested positive for coronavirus antibodies at a clinic in Corona, Queens, while only 56% tested positive at another clinic in Jackson Heights, Queens. https://t.co/lVs0EBXCVW",False,CNN,48997531,1109,False
1282049537885044743,2020-07-11 20:30:03+00:00,Mexican-American cookbook author and food blogger counts herself among the many Latinos who say they won't buy Goya products after Goya CEO Robert Unanue appeared in the White House Rose Garden and praised President Donald Trump. https://t.co/0jhNIjhKmk,False,CNN,48997531,1109,False
1282045780191215616,2020-07-11 20:15:07+00:00,Michael Cohen is back in federal prison after a dispute with the government over what his lawyers say were restrictions in paperwork designed to prevent him from finishing a book about the president. https://t.co/llNFOZUfJ3,False,CNN,48997531,1109,False
1282042045557886978,2020-07-11 20:00:17+00:00,A federal judge on Friday blocked a new federal regulation that would have required insurers on the Obamacare exchanges that cover abortions to issue separate bills for that coverage. https://t.co/wkDoUyiAfk,False,CNN,48997531,1109,False
1282037949161451521,2020-07-11 19:44:00+00:00,"Training for 13-year-old Tumani, an endangered western lowland gorilla, includes making sure she is comfortable bringing the baby to the animal care team and allowing staff members to help position the baby bottle near her. https://t.co/gKIBE8Aiw8",False,CNN,48997531,1109,False
1282035185056391170,2020-07-11 19:33:01+00:00,"The players of the WNBA's Atlanta Dream jointly signed a statement supporting the Black Lives Matter movement, which they assert is a ""statement of humanity."" Team co-owner Sen. Kelly Loeffler objected to the WNBA's plans to honor the movement https://t.co/rkKKZYlCHq",False,CNN,48997531,1109,False
1282033619633143808,2020-07-11 19:26:48+00:00,"Education experts answer viewer questions on school reopenings. They say:

-Schools will look different in various parts of the country 
-Every district needs a plan B
-Don’t underestimate kids’ ability to adapt to guidelines

https://t.co/ez8fuSX5Wi https://t.co/LGEqd9MBAv",False,CNN,48997531,1109,False
1282032430485057537,2020-07-11 19:22:05+00:00,A Florida man and his three sons are facing criminal charges for allegedly selling a toxic solution to tens of thousands of people as a cure for Covid-19 https://t.co/pjqMYmaTU1,False,CNN,48997531,1109,False
1282029656774975493,2020-07-11 19:11:03+00:00,"Instead of celebrating with free Slurpees on July 7 (7/11), 7-Eleven said it would celebrate its birthday by donating one million meals to Feeding America, a national nonprofit.
https://t.co/taJKWLSKFn",False,CNN,48997531,1109,False
1282026914207735811,2020-07-11 19:00:09+00:00,"A garment manufacturer in Los Angeles with over 300 confirmed coronavirus cases among employees has been ordered closed after an investigation into the deaths of four workers, county health officials said. https://t.co/2pP1WLwEnQ",False,CNN,48997531,1109,False
1282022876233834496,2020-07-11 18:44:07+00:00,"After 2 weeks in New York, Dr. Hartwell Lin came back to his colleagues with first-hand knowledge of how to handle a Covid-19 outbreak -- and, perhaps most importantly, he returned as a living testament to the effectiveness of personal protective equipment https://t.co/Sbtj6L1Ocp",False,CNN,48997531,1109,False
1282020101827497985,2020-07-11 18:33:05+00:00,"Brooklyn Beckham asked Nicola Peltz to marry him, and she said yes, the cameraman and model announced. Beckham's parents are retired soccer star David Beckham and fashion designer Victoria Beckham https://t.co/gWTjDzK4JT",False,CNN,48997531,1109,False
1282017325055643648,2020-07-11 18:22:03+00:00,"""The loudest critics of cancel culture tend to frame it as a sort of inquisition. ... But these condemnations distort the issue at the heart of the debate: power -- who's used to having it, who's trying to be heard,"" writes @BrandonTensley | Analysis https://t.co/xAt5koFYRq",False,CNN,48997531,1109,False
1282016168816128010,2020-07-11 18:17:28+00:00,"Phoenix Union High School District Superintendent Chad Gestson on the decision to have remote learning until at least October: “Our community and our staff were really clear that they don't want week-by-week decisions.”

“We ultimately decided we were ignoring the inevitable.” https://t.co/SedZ3mx7jA",False,CNN,48997531,1109,False
1282016064533073920,2020-07-11 18:17:03+00:00,"Internal documents from the US Centers for Disease Control and Prevention warned that fully reopening K-12 schools and universities would be the ""highest risk"" for the spread of coronavirus, according to a New York Times report https://t.co/nkHxzALUTs",False,CNN,48997531,1109,False
1282014819558752258,2020-07-11 18:12:06+00:00,"""Thank you so much for working through this tough time,"" the note read.
""We are grateful for your delicious food, warm smiles, and great atmosphere... Please know we appreciate you all very much."" https://t.co/2kkb6Pq7hf",False,CNN,48997531,1109,False
1282012300757676032,2020-07-11 18:02:05+00:00,"Six people were hurt in an overnight shooting in Rochester, New York, police said in a statement. The injuries were not life threatening. https://t.co/qbLYJr8BHS",False,CNN,48997531,1109,False
1282010785414356994,2020-07-11 17:56:04+00:00,"Temperatures are expected to reach as high as 106 degrees Fahrenheit in the Dallas-Fort Worth area, and cities further west could see temperatures hit 120 degrees. https://t.co/7LIpVg9BzE",False,CNN,48997531,1109,False
1282010034579415040,2020-07-11 17:53:05+00:00,"The enhanced benefit of $600 provides more than 25 million Americans with more than $15 billion each week, said Andrew Stettner, senior fellow at The Century Foundation. State payments alone replace only about 40% of wages, on average. https://t.co/1t4sGinZ41",False,CNN,48997531,1109,False
1282007768174678016,2020-07-11 17:44:05+00:00,"Many Latinos are angry at Goya Foods CEO Robert Unanue, and are sad and disappointed in him, too. His praise of Trump at a White House ceremony reflect how out of touch CEOs can be to their primary consumers, and to the national mood, writes Raul A. Reyes https://t.co/rKxyXvg9wd",False,CNN,48997531,1109,False
1282004993269272576,2020-07-11 17:33:03+00:00,"This new Disney World park is different.
The biggest difference: crowd size.
Another large difference: performances. Almost all of them have been temporarily suspended, even many of the outdoor shows. https://t.co/m7YjUDrGaF",False,CNN,48997531,1109,False
1282004115556569089,2020-07-11 17:29:34+00:00,"Update: The Florida Department of Health acknowledged a miscalculation in their daily Covid-19 death increase and issued a correction. The state is now reporting 95 additional deaths, not 188. This tweet replaces a previous tweet that contained the error. https://t.co/Uv0yYTDGpW",False,CNN,48997531,1109,False
1282002224198148096,2020-07-11 17:22:03+00:00,"""The world is a different place, but we feel really prepared to operate in this new environment that we're in,"" says Josh D'Amaro — the new chairman of Disney Parks, Experiences and Products about the reopening of Disney World in Florida https://t.co/aNDQW2aWAt",False,CNN,48997531,1109,False
1281999710610481152,2020-07-11 17:12:04+00:00,"An angry announcement about  Roger Stone, one of Trump's earliest and most steadfast political allies, issued by the White House reflected the rage of an administration that is besieged and bewildered, writes Errol Louis via @CNNOpinion https://t.co/lyJ6wuheD4",False,CNN,48997531,1109,False
1281997446453886983,2020-07-11 17:03:04+00:00,"Join Michael @Smerconish for an entertaining and poignant look at his one of a kind career. ""Things I Wish I Knew Before I Started Talking” airs tonight at 10 p.m. ET https://t.co/iXtBaAdl9P",False,CNN,48997531,1109,False
1281994924255322112,2020-07-11 16:53:02+00:00,Here's a breakdown of 12 baseless claims from the White House statement on Roger Stone's commutation https://t.co/zh0IXfnYC6,False,CNN,48997531,1109,False
1281992657036890112,2020-07-11 16:44:02+00:00,"With rising Covid-19 cases and hospitalizations sending many states backward in their reopening plans, one health expert warns that if the US continues on its current path, it will reach ""one of the most unstable times in the history of our country."" https://t.co/SOPIqJX3Cz",False,CNN,48997531,1109,False
1281989902117285889,2020-07-11 16:33:05+00:00,"Jada Pinkett Smith and Will Smith came together for a special edition of her ""Red Table Talk"" show on Facebook to share their side of the controversy surrounding her relationship with singer August Alsina. https://t.co/1URbg3FOxy",False,CNN,48997531,1109,False
1281988614830923776,2020-07-11 16:27:58+00:00,"“We’re having to pivot because the data keeps getting worse in Texas,” Dallas schools superintendent Michael Hinojosa says about reopening plans.

“We’ll find a way to get it done, but it is taxing all of our resources to make sure we have everyone in a safe format.” https://t.co/VzusI7vqsA",False,CNN,48997531,1109,False
1281987135541850112,2020-07-11 16:22:05+00:00,"The top writer for Fox News host Tucker Carlson has for years been using a pseudonym to post bigoted remarks on an online forum that is a hotbed for racist, sexist, and other offensive content, CNN Business learned this week https://t.co/sUeYUGzhOl",False,CNN,48997531,1109,False
1281984607437631488,2020-07-11 16:12:03+00:00,A bus driver in France who was beaten up by passengers refusing to wear mandatory face masks has died https://t.co/h4StaFg2zT,False,CNN,48997531,1109,False
1281981345875533827,2020-07-11 15:59:05+00:00,"House Speaker Nancy Pelosi blasts President Trump's Roger Stone commutation as ""an act of staggering corruption"" as Trump defends his decision https://t.co/y11znXFpPb https://t.co/YONuWi3boJ",False,CNN,48997531,1109,False
1281977330781618177,2020-07-11 15:43:08+00:00,"Nearly 1.5 million teachers are at higher risk of serious illness if they contract coronavirus, report finds. https://t.co/sWADWjNi2O",False,CNN,48997531,1109,False
1281974418370105345,2020-07-11 15:31:33+00:00,"Disney World has reopened in Florida today, as the state reports more than 10,000 new coronavirus cases.

@NatashaChenCNN reports on what visitors can expect. https://t.co/8v3IY4rk2x https://t.co/0LXc8AOIrb",False,CNN,48997531,1109,False
1281974293749018624,2020-07-11 15:31:04+00:00,"A new study has found a significant increase in ""broken heart syndrome"" at two Ohio hospitals among some patients who don't have coronavirus, suggesting that the physical, social and economic stressors from the pandemic are taking a physical toll https://t.co/GjPDDMrEnp",False,CNN,48997531,1109,False
1281970011112906752,2020-07-11 15:14:03+00:00,"Refusing to wear a face mask during the Covid-19 pandemic should be as socially unacceptable as drunk-driving or driving without using a seat belt, a UK science official says. https://t.co/3grQSitWhh",False,CNN,48997531,1109,False
1281967005134987269,2020-07-11 15:02:06+00:00,"""I didn't choose this. I beg them to extend it.""

Still-unemployed workers plead for Congress to extend weekly federal unemployment benefits https://t.co/RIgQS2vE39",False,CNN,48997531,1109,False
1281963852532461572,2020-07-11 14:49:34+00:00,"Four months after closing because of the coronavirus pandemic, Walt Disney World Resort in Florida has officially reopened. https://t.co/OA7cl1hrnw https://t.co/kCByUmjG78",False,CNN,48997531,1109,False
