id_str,created_at,full_text,truncated,user.screen_name,user.followers_count,user.friends_count,retweeted
1276431266674626563,2020-06-26 08:25:03+00:00,"Four years on from the UK's Brexit vote, a majority of British voters would now opt to remain inside the European Union, says new research. Read more from CNN's @lukemcgee: https://t.co/B1o9z2goGC",False,CNN,48997543,1109,False
1276430268375629824,2020-06-26 08:21:05+00:00,"Four years on from the UK's Brexit vote, a majority of British voters would now opt to remain inside the European Union, says new research. Read more from CNN's @lukemcgee: https://t.co/Yc1eXfI4Cc",False,CNN,48997543,1109,False
1276425228936253446,2020-06-26 08:01:04+00:00,"More than 100 people in the gaming industry, most of them women, have publicly alleged they were sexually assaulted, harassed or discriminated against on the basis of their gender by fellow gamers https://t.co/L2AjEti9Rb",False,CNN,48997543,1109,False
1276417682779316229,2020-06-26 07:31:04+00:00,"Seattle's KeyArena will now be called Climate Pledge Arena after Amazon secured naming rights, and will feature new green initiatives.

Amazon CEO Jeff Bezos said the name is meant to be ""a regular reminder of the urgent need for climate action."" https://t.co/VWKzkFSAsY",False,CNN,48997543,1109,False
1276415678757646336,2020-06-26 07:23:07+00:00,"""If Telegram removed these channels, it would signal to other White supremacist users that Telegram is taking a stand on content removal.""

White supremacists openly organize racist violence on Telegram, a report has found. https://t.co/avTF9tP5LB https://t.co/wlgtxjmWrn",False,CNN,48997543,1109,False
1276410144050511872,2020-06-26 07:01:07+00:00,"Nearly half a million Americans turned to the federal Obamacare exchanges after losing health insurance coverage this year, new federal data shows https://t.co/t0ab0AYl3w",False,CNN,48997543,1109,False
1276406352710172673,2020-06-26 06:46:03+00:00,"It might look scary. But this eel-like creature plays a ""vital"" role in its ecosystem. https://t.co/86y2STsOGC",False,CNN,48997543,1109,False
1276402590809567233,2020-06-26 06:31:06+00:00,"Bill Gates says the current coronavirus picture, globally and in the US, is ""more bleak"" than he would have expected.

The fact that people are still dying in the US shows that the country is ""not even close"" to doing enough to fight the pandemic, he says. https://t.co/YVs9OA3UQu",False,CNN,48997543,1109,False
1276394730088169473,2020-06-26 05:59:52+00:00,"""We still have over four months to go. ... But for now, Biden is up significantly in the states most likely to determine the outcome of the 2020 election, including the pivotal state of Wisconsin,"" writes @ForecasterEnten https://t.co/BsAvJ20kfh",False,CNN,48997543,1109,False
1276392078969356288,2020-06-26 05:49:20+00:00,"A third of British people have enjoyed coronavirus lockdown, according to a massive study that tracked the emotions of more than 70,000 people in the last 14 weeks.

But the survey also highlighted the social inequalities that impacted people's experience. https://t.co/qSa5quTjtl",False,CNN,48997543,1109,False
1276389802951217152,2020-06-26 05:40:17+00:00,"When it comes to John Bolton's allegations that US President Trump asked Chinese President Xi Jinping for reelection help and voiced approval for mass detention camps in the Muslim-majority region of Xinjiang, Chinese media has largely stayed quiet https://t.co/vef5CDZukG",False,CNN,48997543,1109,False
1276386983758176256,2020-06-26 05:29:05+00:00,"Joseph Dunford, one of the nation's most senior retired generals, is being considered by House Speaker Pelosi and Senate Majority Leader McConnell to lead a panel overseeing $500 billion in funds to aid business and local governments hit by the pandemic https://t.co/ghzAVvifWJ",False,CNN,48997543,1109,False
1276386725997273089,2020-06-26 05:28:04+00:00,"Attorney General William Barr's comments come as public health experts in President Trump's own administration have encouraged voting by mail due to the coronavirus pandemic, and in the absence of any evidence of widespread or rampant fraud in US elections https://t.co/tBpMBCtl7M",False,CNN,48997543,1109,False
1276386214753468418,2020-06-26 05:26:02+00:00,"As the world responds to Covid-19 and the fight against injustice, CNN Heroes Annette March-Grier and Mary Robinson are helping people manage their feelings of grief and loss https://t.co/XBVpDJvkCw",False,CNN,48997543,1109,False
1276385209122992128,2020-06-26 05:22:02+00:00,"China is introducing a sweeping national security law for Hong Kong that has sparked protest, fear and controversy in the semi-autonomous city.

Here's what you need to know about the bill ⁠— and what it means for Hong Kong. https://t.co/XSl3NAulN8",False,CNN,48997543,1109,False
1276382700908285953,2020-06-26 05:12:04+00:00,"Pregnant women who get infected with coronavirus are more likely to be hospitalized, admitted to an intensive care unit and put on a ventilator compared with women who are not expecting, according to a new CDC report https://t.co/NIZ7L4iEJG",False,CNN,48997543,1109,False
1276382179396706304,2020-06-26 05:10:00+00:00,"""Calling Texas... a hotspot is like calling the sun a hotspot. Yeah, I'd say it's hot. The pandemic is roaring..."" says Dr. Jonathan Reiner, who was the cardiologist for former VP Dick Cheney. https://t.co/XRQQnMyJJO https://t.co/tTgVtcDJXh",False,CNN,48997543,1109,False
1276381954146009088,2020-06-26 05:09:06+00:00,The Federal Reserve will require all large banks to suspend share buybacks in the third quarter and will cap shareholder dividends to make sure the financial institutions remain strong enough to lend to the nation's struggling businesses https://t.co/JSsG0knwXc,False,CNN,48997543,1109,False
1276381536204533760,2020-06-26 05:07:26+00:00,"""Museums now have the chance to face their history and refuse the temptation to excuse outdated displays and collections of dubious provenance as the products of an earlier era,"" anthropologist Hugh Raffles writes for @CNNOpinion https://t.co/YMx1irTXsG",False,CNN,48997543,1109,False
1276379914522918912,2020-06-26 05:01:00+00:00,"""It was reasonable for people to think a hate crime had been committed,"" says ESPN host Bomani Jones of the garage door pull rope fashioned like a noose discovered in the garage of NASCAR driver Bubba Wallace. https://t.co/0wXBpBfEkI https://t.co/Rlggyx9dmP",False,CNN,48997543,1109,False
1276378429512974337,2020-06-26 04:55:06+00:00,"The Houston Association of Realtors will use ""primary"" to describe bedrooms and bathrooms on its listing service instead of ""master."" Amid increasing calls for racial justice, such wording has fallen out of favor due to an association with slavery. https://t.co/BBF8yegfqD",False,CNN,48997543,1109,False
1276377397776879618,2020-06-26 04:51:00+00:00,"Houston Mayor Sylvester Turner says ""this virus is reminding us every day that it never left us"" as the situation on the ground in Texas halts its reopening amid Covid-19 surge. https://t.co/XRQQnMyJJO https://t.co/yGDiQMmAsV",False,CNN,48997543,1109,False
1276377174493335553,2020-06-26 04:50:06+00:00,Verizon said it is pulling its advertising from Facebook in what may be the biggest brand yet to join the boycott of the social media platform https://t.co/lplaubX6G1,False,CNN,48997543,1109,False
1276376655183872000,2020-06-26 04:48:03+00:00,"As America takes a look at policing practices, research shows that removing law enforcement from school campuses — as some have called for — would be a mistake, writes Ryan Petty, whose daughter Alaina died in the Parkland school shooting. | @CNNOpinion https://t.co/yrR4sRusbU",False,CNN,48997543,1109,False
1276374881240784896,2020-06-26 04:41:00+00:00,"""Too many of us are led by too many people who refuse to do the right thing,"" says @ChrisCuomo. ""Now at least 30 states have surging coronavirus cases."" https://t.co/9Hk04HTHge https://t.co/7yBipQHaP1",False,CNN,48997543,1109,False
1276374628865396736,2020-06-26 04:40:00+00:00,"Delta Air Lines, United Airlines and American Airlines have each said they've taken action to ban at least one passenger who refused to wear a mask on a flight https://t.co/MVpuxomWto",False,CNN,48997543,1109,False
1276372364624711680,2020-06-26 04:31:00+00:00,Former MLB All-Star @AROD says some proposed social distancing measures and regulations for the Major League Baseball season will be “challenging” to follow. He adds that 400+ balls may be required for each game under new rules. https://t.co/F2IYKp0b1B https://t.co/6kTqqAd17V,False,CNN,48997543,1109,False
1276371232712245248,2020-06-26 04:26:30+00:00,"""The trouble with Trump's rerun approach is that he's not an outsider anymore. He's the President -- which means he bears responsibility for the state our country is currently in,"" writes Michael D'Antonio for @CNNOpinion https://t.co/FyyQtiVy0R",False,CNN,48997543,1109,False
1276368424550236160,2020-06-26 04:15:20+00:00,"A city councilman and a councilman-elect are among the four people charged with voting fraud related to a May 12 municipal election, New Jersey Attorney General Gurbir Grewal announced https://t.co/3FifXZcu8V",False,CNN,48997543,1109,False
1276368119544635397,2020-06-26 04:14:08+00:00,Chuck Schumer has to look at the (still pending) results of Tuesday's Democratic primaries in the Empire State with real trepidation as he looks ahead to his 2022 reelection race. | Analysis by @CillizzaCNN https://t.co/EJKEwYDFLW,False,CNN,48997543,1109,False
1276367856163315713,2020-06-26 04:13:05+00:00,"If 95% of Americans wore face masks in public, it could prevent 33,000 deaths by October 1, according to the University of Washington's Institute for Health Metrics and Evaluation https://t.co/NCzsD51xbs",False,CNN,48997543,1109,False
1276367079805837313,2020-06-26 04:10:00+00:00,"“People are not complying enough,” Miami Beach Mayor Dan Gelber says about people wearing masks in public and following social distancing measures. “There’s no unity of approach right now, like there would be for any other challenge like a hurricane or any other disaster.” https://t.co/pwU1ryK8lL",False,CNN,48997543,1109,False
1276365243950592000,2020-06-26 04:02:42+00:00,"RT @CNNSitRoom: “We found in most states across the country, the rules for wearing masks are inconsistent, confusing, not communicated well…",False,CNN,48997543,1109,False
1276365066804162566,2020-06-26 04:02:00+00:00,"Miami Beach Mayor Dan Gelber pushes back against Gov. Ron DeSantis stating that a surge in coronavirus cases is due to increased testing. “This is real. We’re getting an increase in hospitalizations, an increase in the percentage. There’s much more virus in our community."" https://t.co/4nmTcThEHw",False,CNN,48997543,1109,False
1276364839867297793,2020-06-26 04:01:06+00:00,"More than 30% of civilian pilots in Pakistan have fake licenses and are not qualified to fly, the country's aviation minister has revealed https://t.co/HAUTX3PhKP",False,CNN,48997543,1109,False
1276364459284541440,2020-06-26 03:59:35+00:00,The Trump administration has asked the Supreme Court to invalidate the Affordable Care Act https://t.co/t0eJ6PYOxA,False,CNN,48997543,1109,False
1276362537995509761,2020-06-26 03:51:57+00:00,"The White House has announced that Vice President Mike Pence would lead a public coronavirus task force briefing Friday morning, the first public meeting in almost two months https://t.co/3CKRVSzeYp",False,CNN,48997543,1109,False
1276360117743747072,2020-06-26 03:42:20+00:00,"J.D. Power released its annual quality study and it's terrible news for Tesla, which ranked dead last among the 32 automotive brands it measured https://t.co/XBTmmbkisg",False,CNN,48997543,1109,False
1276357049094463488,2020-06-26 03:30:08+00:00,"KeyArena in Seattle is going green and getting a new name.

The stadium will now be called Climate Pledge Arena after Amazon secured its naming rights, and will feature new green initiatives in an effort to be more climate-friendly. https://t.co/MbAvgMt1X7",False,CNN,48997543,1109,False
1276354516678520832,2020-06-26 03:20:04+00:00,"Mastercard and Visa are reconsidering whether to allow Wirecard to continue processing payments on their networks, following the fintech company's massive accounting scandal, according to a report from Bloomberg https://t.co/6O9Q9RPnzT",False,CNN,48997543,1109,False
1276354263262904321,2020-06-26 03:19:04+00:00,"A bipolar Queens man holding a sword died after being tased by police officers on Sunday, according to the NYPD https://t.co/aaNuWKTySf",False,CNN,48997543,1109,False
1276353830310031360,2020-06-26 03:17:21+00:00,Fact check: President Trump responded to the Supreme Court's ruling last week against his attempt to terminate DACA with two tweets that were full of false and misleading claims. Here's a breakdown. https://t.co/dgK4FHPlaR,False,CNN,48997543,1109,False
1276353511241011200,2020-06-26 03:16:05+00:00,"Danish PM Mette Frederiksen says she's postponed her wedding to attend the European Council meeting in July.

EU leaders are scheduled to meet face-to-face for the first time since the coronavirus outbreak to discuss the European budget and recovery plans. https://t.co/jzjeNchgrB",False,CNN,48997543,1109,False
1276352245853048832,2020-06-26 03:11:03+00:00,"""With Trump's own political outlook dimming significantly, it now also appears as though he's lost his magic touch in picking primary winners as well,"" writes @CillizzaCNN https://t.co/SZHpOvblbL",False,CNN,48997543,1109,False
1276350998689320960,2020-06-26 03:06:06+00:00,"Nearly half a million Americans turned to the federal Obamacare exchanges after losing health insurance coverage this year, new federal data shows.

Sign-ups spiked in April to more than double the number in prior Aprils as jobs were lost amid the pandemic https://t.co/aOALJmBHHF",False,CNN,48997543,1109,False
1276350327168565248,2020-06-26 03:03:26+00:00,"The United States has removed key ally Saudi Arabia from its list of the worst offenders on human trafficking after just a year.

The State Department's 2020 Trafficking in Persons Report said the country had made ""key achievements"" in the last 12 months. https://t.co/nRtCf66NXg",False,CNN,48997543,1109,False
1276346626882310145,2020-06-26 02:48:43+00:00,"Ashanti Palmer not only graduated from a New York high school as class valedictorian, but also with perfect attendance.

The senior never missed a day of school from pre-K through high school, according to Mount Vernon City School District. https://t.co/XoKj5ykgOF",False,CNN,48997543,1109,False
1276346608817516544,2020-06-26 02:48:39+00:00,"Looking to maintain its place as America's best-selling truck, Ford has revealed its new F-150 for the 2021 model year.

The truck is available in a hybrid version that Ford says can travel up to an estimated 700 miles on a single tank of gas. https://t.co/sgUqdaoALa https://t.co/BNbRrvHqph",False,CNN,48997543,1109,False
1276345819772227584,2020-06-26 02:45:31+00:00,"The gaming industry has taken notice of widespread accounts of misconduct, and some companies are beginning to act https://t.co/mc0Z1JthS7",False,CNN,48997543,1109,False
1276342759817969664,2020-06-26 02:33:21+00:00,People who have spoken to the President recently say he seems aimless as coronavirus cases surge and as a national racial reckoning reaches entities from NASCAR to Disney https://t.co/mxezjG4enF,False,CNN,48997543,1109,False
1276340417232076803,2020-06-26 02:24:03+00:00,"A small Ohio automotive startup is drawing national attention for its new electric pickup truck. If Lordstown Motors' first and only product is a hit, it could reshape the auto market and help revive a languishing Rust Belt town. But some questions linger. https://t.co/355yWtHjGO",False,CNN,48997543,1109,False
1276337342647861248,2020-06-26 02:11:50+00:00,"The sea lamprey, an eel-like creature colloquially referred to as the ""vampire fish,"" provides benefits that outweigh its bite, says Vermont Fish &amp; Wildlife. However, a non-native species of sea lamprey is considered an invasive species in Lake Champlain. https://t.co/wnUBrAsltE",False,CNN,48997543,1109,False
1276334902510850049,2020-06-26 02:02:08+00:00,Financial regulators said they plan to make it easier to let banks invest in venture capital funds and also relax limitations on derivatives trading. The moves are a loosening of some of the more onerous parts of the so-called Volcker Rule. https://t.co/OPn1O4eysu,False,CNN,48997543,1109,False
1276334817660096513,2020-06-26 02:01:48+00:00,"Philadelphia officials plan to remove the statue of Christopher Columbus in Marconi Plaza, according to a statement from Mayor Jim Kenney's office https://t.co/SBtFk7oYtw",False,CNN,48997543,1109,False
1276333133286293506,2020-06-26 01:55:06+00:00,Fiinancial regulators said they plan to make it easier to let banks invest in venture capital funds and also relax limitations on derivatives trading. The moves are a loosening of some of the more onerous parts of the so-called Volcker Rule. https://t.co/tt5RJJsjy7,False,CNN,48997543,1109,False
1276332623070203904,2020-06-26 01:53:05+00:00,"Beyoncé's mother, Tina Knowles-Lawson, is urging Senate leaders to pass legislation to protect the voting rights of all registered voters, especially Black and Brown communities disproportionately affected by Covid-19 https://t.co/5N0kszx6Tx",False,CNN,48997543,1109,False
1276331598535933953,2020-06-26 01:49:00+00:00,"The age of women giving birth climbed as infant death rates declined in the US between 2000 and 2017, the CDC says.

But the welcome news was tempered by the fact that Black infants still have over twice the risk of dying as White infants. https://t.co/b4psiPGp6v",False,CNN,48997543,1109,False
1276329279513677825,2020-06-26 01:39:47+00:00,"Telecom giant Verizon said it is pulling its advertising from Facebook, in what may be the biggest brand yet to join the boycott.

The announcement marks the first US telecom giant to join the boycott. https://t.co/AUbbXianM8",False,CNN,48997543,1109,False
1276326489756180480,2020-06-26 01:28:42+00:00,"With the Fourth of July around the corner, countless Americans are contemplating holiday travel. But is it safe?

From what to pack, where to stop, and whether your pets can join, @DrSanjayGupta shares helpful hints for your summer journey. #CNNTownHall https://t.co/CVsZUaZRs8 https://t.co/A58jRwu6Nx",False,CNN,48997543,1109,False
1276326327466037248,2020-06-26 01:28:04+00:00,"Several lawmakers from Texas, on both sides of the aisle, are asking the Trump administration to reconsider its decision to halt direct funding to several coronavirus testing sites in the Lone Star State, where there has been a surge of Covid-19 cases https://t.co/WhxNz0MJRq",False,CNN,48997543,1109,False
1276324133446529024,2020-06-26 01:19:21+00:00,"Microsoft founder Bill Gates said the current coronavirus picture, globally and in the US, is ""more bleak"" than he'd have expected.

He said the fact that people are still dying in the US today shows the US is ""not even close"" to doing enough. #CNNTownHall https://t.co/Tjk5EBU9x9",False,CNN,48997543,1109,False
1276320039382200321,2020-06-26 01:03:04+00:00,"Kosovan President Hashim Thaci has been indicted for war crimes allegedly committed during the Kosovo conflict in the late 1990s, leading him to cancel a planned trip to the White House this weekend for talks with Serbian leaders https://t.co/ClM5oTO5Fq",False,CNN,48997543,1109,False
1276319792731959297,2020-06-26 01:02:06+00:00,"House Armed Services Chairman Adam Smith is proposing the creation of a new $1 billion fund for the Pentagon to better prepare for pandemics, according to committee aides and a copy of the legislation obtained by CNN https://t.co/p8KVUwMy3W",False,CNN,48997543,1109,False
1276319539525976064,2020-06-26 01:01:05+00:00,"Secretary of Defense Mark Esper has approved a request from the DHS to continue military support to the southern border but reduce the number of authorized troops by 1,500 with most of the 4,000 deployed drawn from the National Guard, the Pentagon says https://t.co/BkHv4dIveN",False,CNN,48997543,1109,False
1276319022208839680,2020-06-26 00:59:02+00:00,"""I'm still pretty disappointed,"" says Bill Gates on the Trump administration's handling of coronavirus. ""Without US leadership, it's been hard to pull together a response, and now the developing countries are bearing the brunt of the burden."" #CNNTownHall https://t.co/9Hk04HC5RE https://t.co/WV8F8Kpe0N",False,CNN,48997543,1109,False
1276318431407554561,2020-06-26 00:56:41+00:00,"Bill Gates suggests he speaks with Dr. Anthony Fauci more than Fauci speaks with President Trump, saying, ""I talk to him regularly, more often than he talks to some other people."" #CNNTownHall https://t.co/9Hk04HC5RE https://t.co/3vvrVYs3bX",False,CNN,48997543,1109,False
1276318380950278146,2020-06-26 00:56:29+00:00,Many police watchdogs remain largely powerless over the agencies they are tasked with disciplining https://t.co/u6WQ8hbCvy,False,CNN,48997543,1109,False
1276314793025114112,2020-06-26 00:42:14+00:00,"Astronomers have discovered two super-Earth exoplanets orbiting a star 11 light-years away from Earth, according to a new study. There is also a potential third planet orbiting a bit further away from the star, according to the researchers. https://t.co/bPg9vAs95M",False,CNN,48997543,1109,False
1276313564781797376,2020-06-26 00:37:21+00:00,"Bill Gates predicts coronavirus will ""be back in big numbers"" in October and November ""if we don't restrain our behavior more than it looks like we are right at the moment."" #CNNTownHall https://t.co/9Hk04HC5RE https://t.co/4Ex5d2lops",False,CNN,48997543,1109,False
1276313260501790721,2020-06-26 00:36:08+00:00,"Bill Gates says it's ""completely false"" that testing is the reason the US has so many coronavirus cases.

""It's fair to say that you can find more cases when you do more testing, but the US is experiencing a rebound even once you factor out the increased testing."" #CNNTownHall https://t.co/NLbdwqRaOT",False,CNN,48997543,1109,False
1276312473185013760,2020-06-26 00:33:01+00:00,Most of Alaska's 23 million acre National Petroleum Reserve would be open for oil and gas leasing under a new Trump administration plan https://t.co/WMhs5KYdpy,False,CNN,48997543,1109,False
1276312248005394433,2020-06-26 00:32:07+00:00,"The organizers behind a Wisconsin music festival called the ""COVID Herd Immunity Fest"" changed its name this week after they were met with a wave of backlash on social media https://t.co/GIu5xhUeI1",False,CNN,48997543,1109,False
1276311172376076294,2020-06-26 00:27:50+00:00,"Four years on from the UK's Brexit vote, a majority of British voters would now opt to remain inside the European Union, according to new research https://t.co/YNm2PEWbVk",False,CNN,48997543,1109,False
1276308604501389312,2020-06-26 00:17:38+00:00,"""We started off behind the curve, and we have never caught up.""

@drsanjaygupta says the US has not done nearly enough to stop the spread of coronavirus. #CNNTownHall https://t.co/9Hk04HC5RE https://t.co/tONGmKZE1D",False,CNN,48997543,1109,False
1276308339929088000,2020-06-26 00:16:35+00:00,"Joe Biden lambasted President Trump's push to repeal the Affordable Care Act, saying that if Trump gets his way, those who contract coronavirus could lose coverage or face higher premiums https://t.co/vWSGApFyj1",False,CNN,48997543,1109,False
1276305190120050690,2020-06-26 00:04:04+00:00,Russia kicked off early voting in a national referendum on controversial amendments to the country's constitution that could allow President Vladimir Putin stay in power until 2036 https://t.co/cf91TO9djR,False,CNN,48997543,1109,False
1276303943967084544,2020-06-25 23:59:07+00:00,".@BillGates joins @drsanjaygupta and @andersoncooper for a new CNN Global Town Hall, ""Coronavirus: Facts and Fears.""

📺 Watch now on CNN: https://t.co/UYpqI3w42L

🗨️ Tweet your questions: #CNNTownHall

📲 Follow the latest updates: https://t.co/DX7MmXSll9 https://t.co/PHXN5u9Ngs",False,CNN,48997543,1109,False
1276302416170844160,2020-06-25 23:53:03+00:00,"The Department of Justice is calling Hawaii's mandated 14-day self-quarantine for travelers from outside the state likely unconstitutional, discriminatory and ""insufficiently tailored to ensuring public safety"" https://t.co/upJ0XhzGcD",False,CNN,48997543,1109,False
1276301565205319681,2020-06-25 23:49:40+00:00,"The charismatic German with the extra-large personality promised change and raised the decibels. Though it has taken him five years to win English football's biggest prize, Jurgen Klopp's impact on Liverpool was immediate. https://t.co/IEO8YI6vU5",False,CNN,48997543,1109,False
1276301053911281664,2020-06-25 23:47:38+00:00,What questions do you have about the coronavirus pandemic? @BillGates joins @drsanjaygupta and @andersoncooper for a new Global Town Hall tonight at 8p ET. Tweet your questions with #CNNTownHall and we will feature some during the one-hour special.,False,CNN,48997543,1109,False
1276297760313085952,2020-06-25 23:34:33+00:00,"House Democrats are showing little appetite to flex their investigative muscles in the final year of President Donald Trump's first term, with many eager to proceed cautiously and avoid overzealous probes that could backfire politically https://t.co/EhaBIWgeC8",False,CNN,48997543,1109,False
1276295443631177728,2020-06-25 23:25:20+00:00,".@BillGates joins @drsanjaygupta and @andersoncooper for a new CNN Global Town Hall, ""Coronavirus: Facts and Fears,"" tonight at 8p ET.

📺 Watch CNN: https://t.co/UYpqI3w42L

🗨️ Tweet your questions: #CNNTownHall

📲 Follow the latest updates: https://t.co/bfM5wJ20yX https://t.co/uHUiogmUr4",False,CNN,48997543,1109,False
