id_str,created_at,full_text,truncated,user.screen_name,user.followers_count,user.friends_count,retweeted
1278619953202188289,2020-07-02 09:22:07+00:00,"""It's appalling -- we need to know what the hell is going on.""

More than 360 elephants have died in mysterious circumstances in Botswana in the past three months, according to local conservationists. https://t.co/Gks7obQXk9",False,CNN,48997540,1109,False
1278619183438270464,2020-07-02 09:19:03+00:00,"Donald Trump's refusal to set an example by wearing a face covering, despite growing evidence that it may be one of the most effective ways to slow America's increasingly disastrous pandemic, was always a political statement | Analysis by @StCollinson https://t.co/pV7lcpronu",False,CNN,48997540,1109,False
1278616670790209536,2020-07-02 09:09:04+00:00,"Four-time WNBA champion Maya Moore sat out for an entire season to help overturn the conviction of Jonathan Irons, who she said was wrongfully serving a 50-year prison sentence https://t.co/eQzwSpitOB",False,CNN,48997540,1109,False
1278613540102975494,2020-07-02 08:56:38+00:00,A group of former George W. Bush administration and campaign officials has launched a new super PAC to mobilize disaffected Republican voters for presumptive Democratic presidential nominee Joe Biden. https://t.co/c7Tcrv021F,False,CNN,48997540,1109,False
1278610140372049921,2020-07-02 08:43:07+00:00,Four Indian police officers were arrested Wednesday for allegedly murdering a father and son who were in custody after being accused of breaking coronavirus restrictions. https://t.co/kgIFrdhhrL,False,CNN,48997540,1109,False
1278608308220432386,2020-07-02 08:35:50+00:00,"It only took one question for the post on Facebook to go viral: Will you be my pen pal?

Nearly four months into a strict no-visitor rule due to the coronavirus, an assisted living community in North Carolina has tapped into the power of social media. https://t.co/pdttfsmBzn",False,CNN,48997540,1109,False
1278604592725528576,2020-07-02 08:21:04+00:00,"""In the last three weeks, I have seen more admissions and sicker patients than on the previous ten weeks."" 

Inside a Houston hospital partly transformed into a coronavirus specialty unit, one doctor says he expects to reach capacity in the next 14 days. https://t.co/ubhWcpkeJG",False,CNN,48997540,1109,False
1278601823759339521,2020-07-02 08:10:04+00:00,"""I would never have imagined in a million years that I would get this virus the way that I did.""

A healthy 30-year-old man went to a crowded bar. He ended up in a hospital on a breathing tube https://t.co/S7MYvp5JBc https://t.co/4pyGrYwYd6",False,CNN,48997540,1109,False
1278600546799230982,2020-07-02 08:05:00+00:00,"""The idea, as Trump likes to say that, somehow, this information, this intelligence, didn't get up to him is ludicrous,"" says Retired CIA Chief of Russian Operations Steve Hall about President Trump response to the alleged Russian bounty plot. https://t.co/luwDXkT4fh https://t.co/nHh2ZNiTyo",False,CNN,48997540,1109,False
1278599316169424897,2020-07-02 08:00:06+00:00,Police in a Massachusetts town have opened a criminal investigation into a report that a Black woman was followed by a man and allegedly accused of suspicious behavior. https://t.co/AEzlu24hCm,False,CNN,48997540,1109,False
1278598029994582016,2020-07-02 07:55:00+00:00,"""This pandemic is not disappearing,"" says Dr. William Haseltine about President Trump's claim that Covid-19 will ""just disappear."" 

""If you have leadership, governance and individual responsibility, it can be reduced to zero."" https://t.co/NpOIH81zUM https://t.co/SNFj341aHk",False,CNN,48997540,1109,False
1278597286365483009,2020-07-02 07:52:02+00:00,"Former Attorney General Jeff Sessions appeared to refer to Henry Louis Gates Jr., a celebrated Black Harvard University scholar, as ""some criminal"" in a New York Times Magazine article published Tuesday. https://t.co/j0JKP2Ekju",False,CNN,48997540,1109,False
1278595765062062080,2020-07-02 07:46:00+00:00,"Seattle's police chief Carmen Best explains her department's retaking of the autonomous zone saying the situation had become ""very lawless"" and officers had been unable enter the zone without ""extreme resistance.""

""We are restoring order and getting back to business as usual."" https://t.co/Wf2GRP09DG",False,CNN,48997540,1109,False
1278594518414168064,2020-07-02 07:41:02+00:00,"Six FC Dallas players have tested positive for Covid-19 since arriving in Florida ahead of the upcoming ""MLS is Back Tournament,"" the league says. https://t.co/NSJjG4kkyY",False,CNN,48997540,1109,False
1278592997093830656,2020-07-02 07:35:00+00:00,"The CEO of an Arizona gym is suing the governor over the most recent closure order calling the government's decision ""arbitrary.""

""We feel like the cause is... bigger than just this particular business,"" he says. https://t.co/xlHzxH5pgb",False,CNN,48997540,1109,False
1278592017606553600,2020-07-02 07:31:06+00:00,"This was supposed to be the year that Beijing would announce it had ended absolute poverty in China, fulfilling a key pledge of President Xi Jinping and one of the founding missions of the Chinese Communist Party. https://t.co/v2LO2HiRwJ",False,CNN,48997540,1109,False
1278590480348000257,2020-07-02 07:25:00+00:00,"""The men on [Mount Rushmore] Washington, Jefferson, Teddy Roosevelt and Lincoln, none would have handled a crisis like you have so far,"" says @ChrisCuomo to Pres. Trump. ""You want to be in their presence? Why not act more in their image when it comes to how to lead in hard times"" https://t.co/4T3cDVoFi4",False,CNN,48997540,1109,False
1278589229065527296,2020-07-02 07:20:01+00:00,A New York appellate court lifted the temporary restraining order against Simon &amp; Schuster -- the publisher of a tell-all book by Donald Trump's niece -- allowing them to move forward with printing copies of the book and shipping them to retailers https://t.co/wUulxYNfDs,False,CNN,48997540,1109,False
1278587963769671681,2020-07-02 07:15:00+00:00,"When asked by @jimsciutto whether or not she wants the job of vice president, former national security advisor Susan Rice says she would serve in ""any capacity"" she can to help Joe Biden win the presidency and succeed as president. https://t.co/nW0xAsSvzg",False,CNN,48997540,1109,False
1278586725988622336,2020-07-02 07:10:05+00:00,"Donald Trump's refusal to set an example by wearing a face covering, despite growing evidence that it may be one of the most effective ways to slow America's increasingly disastrous pandemic, was always a political statement | Analysis by @StCollinson https://t.co/WNvUyor1H7",False,CNN,48997540,1109,False
1278585447472459777,2020-07-02 07:05:00+00:00,"""This President is derelict in his duty as commander-in-chief to brush off information that is critical to the life and death of our service members and do so just because he doesn't want to hear bad news,"" says former national security advisor to Pres. Obama Susan Rice. https://t.co/PZJ3oPgyKw",False,CNN,48997540,1109,False
1278584459835715584,2020-07-02 07:01:04+00:00,"The number of active-duty military personnel infected with the novel coronavirus has more than doubled in the last three weeks, according to new figures published by the Defense Department https://t.co/IoK1KLdcpG",False,CNN,48997540,1109,False
1278582930533580800,2020-07-02 06:55:00+00:00,"President Trump has ""essentially gone AWOL from the job of leadership that he should be providing a country in trouble,"" says former CIA director Leon Panetta of Pres. Trump's coronavirus response. ""This is a major crisis."" https://t.co/WmaPW03RIY https://t.co/u7Nta1Qubs",False,CNN,48997540,1109,False
1278581937980882944,2020-07-02 06:51:03+00:00,"""I understand masks are inconvenient and uncomfortable. But don't you feel that it's worse that businesses are shutting down ... health care workers are hitting absolute exhaustion. And so many lives have been taken by this virus,"" Jennifer Aniston wrote https://t.co/FOsN8D8mYB",False,CNN,48997540,1109,False
1278581937087696896,2020-07-02 06:51:03+00:00,"If Beijing thought a new national security law would guarantee a quiet birthday for Hong Kong, it was mistaken. 

As the city marked 23 years of Chinese rule Wednesday, thousands of people defied a police ban to take to the streets https://t.co/P9IS4qcCQW",False,CNN,48997540,1109,False
1278580413875748864,2020-07-02 06:45:00+00:00,"""The governor has not preempted us from acting locally,"" says Sarasota, FL Mayor Jen Ahearn-Koch of masks not being mandated statewide.

Ahearn-Koch says she hopes local efforts will ""tip the scales"" for the governor, resulting in statewide regulations. https://t.co/4Be3AeOdNX",False,CNN,48997540,1109,False
1278578921135583235,2020-07-02 06:39:04+00:00,"NPC International, the operator of 1,200 Pizza Hut and nearly 400 Wendy's restaurants in the United States, has filed for bankruptcy. https://t.co/WcdmzL7ESX",False,CNN,48997540,1109,False
1278577897465241602,2020-07-02 06:35:00+00:00,"""We continue to feel the absolute void of a national plan,"" says former Kansas Governor Kathleen Sebelius on Covid-19.

""This President, for the first time in I think anybody's memory, has politicized a public health crisis."" https://t.co/uhBDb92XmJ https://t.co/GTRFNv2ajr",False,CNN,48997540,1109,False
1278576901557280769,2020-07-02 06:31:02+00:00,"Brazilian researchers detected 2,248 fires in the Amazon last month — the highest number of fires recorded in the month of June since 2007, according to Brazil's National Institute for Space Research https://t.co/57yGQCkRnG",False,CNN,48997540,1109,False
1278576417803026432,2020-07-02 06:29:07+00:00,Hawaiian Airlines says it will add hundreds of weekly flights to its schedule between Hawaii and the US mainland as the state government eases a strict quarantine https://t.co/SukGIB2oqM,False,CNN,48997540,1109,False
1278575642158792704,2020-07-02 06:26:02+00:00,A civil rights advocacy group is teaming up with district attorneys in three major US cities to launch commissions that they say will listen to victims of past misconduct within the criminal justice system and try to right the wrongs https://t.co/pwlOcbgeZ9,False,CNN,48997540,1109,False
1278575380731920385,2020-07-02 06:25:00+00:00,"The brother of first responder Shannon Bennett, the first Florida law enforcement officer to die from coronavirus, discusses how the claim they filed with Bennett’s insurance company was denied and its impact. https://t.co/hVH7Q02VMa",False,CNN,48997540,1109,False
1278574115562106881,2020-07-02 06:19:58+00:00,"Covid-19 was the last thing on this 30-year-old's mind when he went to a crowded bar in Scottsdale, Arizona.

Two days later, he awoke with a fever of 103 and body sores, he says. A week later, he was in the hospital, where he was put on a breathing tube. https://t.co/tuNO2i0eBc",False,CNN,48997540,1109,False
1278572864182956032,2020-07-02 06:15:00+00:00,"Brooke Baldwin gets emotional while reading a heartfelt plea to wear masks from CNN colleague Chelsea McGinnis, who has twin boys in the NICU. “Please think of these two tiny boys … if simply wearing a mask protects them, is it really so much to ask?” McGinnis writes. https://t.co/MBYiL92VzF",False,CNN,48997540,1109,False
1278571745373351941,2020-07-02 06:10:33+00:00,"Miami-Dade County Mayor Carlos A. Giménez says he will be passing ordinances “that will make it a civil citation, ... almost like — if you don’t wear your seat belt, give you a ticket when you’re not wearing your mask.”

“We need to be responsible for our actions.” https://t.co/wnThWApUdg",False,CNN,48997540,1109,False
1278571674926006272,2020-07-02 06:10:16+00:00,"A new study analyzed 12 different retail fireworks and found that once set off, five of them released particle emissions that could damage human cells and animal lungs https://t.co/s8V2ZOuM0f",False,CNN,48997540,1109,False
1278570627025244161,2020-07-02 06:06:06+00:00,RT @AC360: President Trump’s resistance to intelligence warnings about Russia led his national security team to verbally brief him less oft…,False,CNN,48997540,1109,False
1278570347919368192,2020-07-02 06:05:00+00:00,"“He won’t be judged for what he didn’t do early on when it was hard… but history will damn him for not acting now when the solution is clear... Wear a mask, social distance, test, track and trace,"" NYT columnist @tomfriedman says about Pres. Trump’s handling of the pandemic. https://t.co/9Vl9MeEQme",False,CNN,48997540,1109,False
1278570235746910208,2020-07-02 06:04:33+00:00,"RT @CNNnewsroom: “It’s the height of hypocrisy for Donald Trump to call anything a symbol of hate. He is the embodiment of hate,"" Melina Ab…",False,CNN,48997540,1109,False
1278569371368075264,2020-07-02 06:01:07+00:00,"""Evidence that America's foes have lost respect for the world's only superpower are everywhere, and they are becoming more troubling with every passing day, raising the question of how safe America is at this pivotal moment"" | @FridaGhitis for @CNNOpinion https://t.co/afGHz3akb7",False,CNN,48997540,1109,False
1278568245461528578,2020-07-02 05:56:39+00:00,"“If I don’t, I’m going to lose my bar… We have rights that are being trampled on right now.” - Texas bar owner Gabrielle Ellison, who is suing Gov. Abbott, on why she is defying shutdown orders and keeping her bar open. https://t.co/mVdTkWseVL",False,CNN,48997540,1109,False
1278567814110916608,2020-07-02 05:54:56+00:00,"On the subject of Black Lives Matter and the removing of Confederate-era statues, Trump has asked, ""Where does it end?""

""I would answer... 'Why did it begin?'"" says @LZGranderson. ""Why were these bases all around the country named after confederate figures to begin with?"" https://t.co/Dn5nHuINQG",False,CNN,48997540,1109,False
1278567580442058752,2020-07-02 05:54:00+00:00,"RT @CNNSitRoom: Bars alone don't account for the recent spikes in Covid-19 cases, but experts say their social atmosphere is especially dan…",False,CNN,48997540,1109,False
1278567245111627776,2020-07-02 05:52:40+00:00,"“The rise in Covid cases are directly correlated with the opening of the state by Gov. Doug Ducey,” says Tucson, Arizona, Mayor Regina Romero. “It is very devastating and Gov. Ducey took a step too quickly.” https://t.co/PdEyQPTI8w",False,CNN,48997540,1109,False
1278567083224133634,2020-07-02 05:52:01+00:00,"Pres. Trump claims coronavirus will “disappear.”

Dr. Sanjay Gupta says President Trump was briefed by the coronavirus task force that “there was no evidence that this was going away. It was too contagious and too embedded in many places around the world.” https://t.co/UhBPdyrEe4 https://t.co/jq2Dludmc4",False,CNN,48997540,1109,False
1278564819134799872,2020-07-02 05:43:02+00:00,"The Kentucky primary could be a model for other states confronting a challenging election this fall, Joshua A. Douglas writes for @CNNOpinion https://t.co/CMrAS3MVQx",False,CNN,48997540,1109,False
1278561818596818944,2020-07-02 05:31:06+00:00,"An old whipping post that was used ""disproportionally on Blacks"" has been removed from outside the Old Sussex County Courthouse in Georgetown, Delaware, a state official says https://t.co/0d4Di8q8QU",False,CNN,48997540,1109,False
1278558948703035393,2020-07-02 05:19:42+00:00,"It only took one question for the post on Facebook to go viral: Will you be my pen pal?

Nearly four months into a strict no-visitor rule due to the coronavirus, an assisted living community in North Carolina has tapped into the power of social media. https://t.co/XvutymK2wy",False,CNN,48997540,1109,False
1278556553877094401,2020-07-02 05:10:11+00:00,"Nordstrom was one of a few select retailers selling the latest model of Nike Dunks athletic shoes, but some sneaker enthusiasts came up empty-handed after the luxury department store chain oversold its stock https://t.co/wNk4q6JqK0",False,CNN,48997540,1109,False
1278554275573051393,2020-07-02 05:01:08+00:00,"About 300 teens were exposed to Covid-19 at a ""pong fest"" party in Lakeway, Texas, on June 20, local officials say https://t.co/9GszJenlJn",False,CNN,48997540,1109,False
1278549699226677248,2020-07-02 04:42:57+00:00,"President Trump's reelection campaign announced that the campaign and the Republican National Committee had taken in $131 million in June, bringing the amount raised in the second quarter of the year to $266 million https://t.co/lpIQsRk42S",False,CNN,48997540,1109,False
1278546703650631680,2020-07-02 04:31:03+00:00,California authorities are suing Cisco and two of its employees for allegedly discriminating against an Indian engineer because he was from a lower caste than them https://t.co/PiQm8ubQx6,False,CNN,48997540,1109,False
1278545950517100545,2020-07-02 04:28:03+00:00,President Trump seemed to struggle to answer what he would do with a potential second term in an interview that aired Wednesday evening https://t.co/uV9I7TN2QE,False,CNN,48997540,1109,False
1278542940982382593,2020-07-02 04:16:05+00:00,"Thieves have taken advantage of the coronavirus pandemic to break into the offices of the European Parliament, according to a member who spoke to CNN https://t.co/fl4iHhg0l2",False,CNN,48997540,1109,False
1278539186174414849,2020-07-02 04:01:10+00:00,"Individual decisions to stay put in homes, except for necessary outings for food and medical supplies, likely helped slow the spread of coronavirus before state or local stay-at-home orders were implemented by government officials, according to a new study https://t.co/DiyIc4xqHS",False,CNN,48997540,1109,False
1278539178498809856,2020-07-02 04:01:08+00:00,A majority of National Women's Soccer League players knelt on one knee during the National Anthem in the opening weekend of its tournament https://t.co/WI4xgaYwVO,False,CNN,48997540,1109,False
1278535384616534017,2020-07-02 03:46:04+00:00,"More Republicans are leaving the House under Trump. But you'd be hard-pressed to hear any of them openly blame Trump for their departures, or criticize him harshly while still in the chamber. | Analysis by @LaurenDezenski https://t.co/tFMSG5Zp9M",False,CNN,48997540,1109,False
1278531614688018434,2020-07-02 03:31:05+00:00,"""I'm worried about Black people, like me, getting hurt. Some skin is like chocolate. Some is like vanilla. Some is mixed together like mine. But we're all people,"" 8-year-old Nolan Davis said through a megaphone at the Black Lives Matter march he organized https://t.co/S3z0solPtF",False,CNN,48997540,1109,False
1278528181482422274,2020-07-02 03:17:27+00:00,The Department of Housing and Urban Development announced Wednesday that it plans to roll back an Obama-era rule that barred federally funded homeless shelters from discriminating against transgender people https://t.co/aqMA7RQeTL,False,CNN,48997540,1109,False
1278527840577863680,2020-07-02 03:16:05+00:00,"A divide has emerged inside President Trump's inner circle over whether he should turn his attention back to the coronavirus pandemic or continue to focus on reopening the economy, sources say https://t.co/mxR6YCqU7y",False,CNN,48997540,1109,False
1278527005227716608,2020-07-02 03:12:46+00:00,"The main security checkpoint at the Atlanta airport was closed for cleaning after an employee tested positive for coronavirus, according to the TSA. A few lanes were reopened as of Wednesday evening, but it will ""likely not fully open until tomorrow."" https://t.co/KfJgpT19Vt",False,CNN,48997540,1109,False
1278525388197629955,2020-07-02 03:06:21+00:00,"At least 38 students living in 10 fraternity houses near the University of Washington's campus have tested positive for the coronavirus, the university said this week https://t.co/2d9Dzs0gli",False,CNN,48997540,1109,False
1278524083286806529,2020-07-02 03:01:09+00:00,"When the next Congress is sworn in to office in January 2021, there's a high likelihood it will have among its Republican members someone who is sympathetic to a wild, unsubstantiated conspiracy theory known as QAnon https://t.co/jRpoggytQg",False,CNN,48997540,1109,False
1278521535549050880,2020-07-02 02:51:02+00:00,Texas Gov. Greg Abbott last week ordered bars in the state to reclose. But that's not stopping the owner of a bar in Odessa from welcoming customers during the July 4 holiday weekend. https://t.co/rbqktftNFi,False,CNN,48997540,1109,False
1278520288691531776,2020-07-02 02:46:05+00:00,"The Fort Lauderdale Police officer seen on video shoving a kneeling protester and then being scolded by a fellow officer has been charged with misdemeanor battery, according to court records https://t.co/fzAgho81d3",False,CNN,48997540,1109,False
1278518569945444353,2020-07-02 02:39:15+00:00,"American households with children are being disproportionately impacted by food insecurity and missed housing payments due to the coronavirus pandemic, according to a new analysis from the US Census Bureau https://t.co/SWILYSs6cE",False,CNN,48997540,1109,False
1278518415033094145,2020-07-02 02:38:38+00:00,Senate Republicans have a simple message after President Trump dashed off a late-night tweet Tuesday threatening to veto their must-pass defense policy bill over the renaming of bases named for Confederate leaders: Give it some time. https://t.co/O9qGyJ7Y8m,False,CNN,48997540,1109,False
1278518035423334411,2020-07-02 02:37:08+00:00,"The FBI conducted more than 3.9 million background checks associated with the sale, transfer or permitting of firearms in June, making it the highest month on record for background checks since the bureau began keeping statistics in 1998, new data shows https://t.co/MeBbO3RLZB",False,CNN,48997540,1109,False
1278514751056891904,2020-07-02 02:24:04+00:00,"Three senators proposed a bill to end qualified immunity, a legal doctrine that critics say is shielding law enforcement and government officials from accountability https://t.co/C8LzmRgE8f",False,CNN,48997540,1109,False
1278513983708856322,2020-07-02 02:21:02+00:00,"Eight Louisiana police officers are accused of using excessive force against two men a prosecutor said had ""raised their hands ... in an apparent attempt to surrender without resistance"" following a chase https://t.co/RZrWfnAMes",False,CNN,48997540,1109,False
1278513444313055233,2020-07-02 02:18:53+00:00,"""I was just sick to my stomach.""

Dozens of headstones were found toppled over, and some destroyed, when staff at an Iowa cemetery arrived at work on Tuesday morning. https://t.co/Ruy0SoBjk4",False,CNN,48997540,1109,False
1278510071580897282,2020-07-02 02:05:29+00:00,"""The United States Postal Service is in crisis, and one person is standing in the way of its salvation: President Donald J. Trump,"" writes Rep. Gerry Connolly for @CNNOpinion https://t.co/xmdlpvA1pc",False,CNN,48997540,1109,False
1278508008658567171,2020-07-02 01:57:17+00:00,"Researchers have found the first confirmed underwater Aboriginal archaeological sites off the coast of Australia, and predict that there are many more to be discovered https://t.co/5MPoQ64D9v",False,CNN,48997540,1109,False
1278498518605467651,2020-07-02 01:19:34+00:00,"More than a dozen members of Brazil's indigenous Xavante people have recently died of coronavirus symptoms, adding fuel to fears that the virus would hit the country's indigenous populations hard https://t.co/QJG8tDHlSK",False,CNN,48997540,1109,False
1278497793498320896,2020-07-02 01:16:41+00:00,"Joe Biden said this week that two recent Trump administration appointees to the Pentagon and USAID ""have no business serving in high positions in our government"" because of past Islamophobic and offensive comments on social media https://t.co/T3Kyfn93a8",False,CNN,48997540,1109,False
1278496599413592065,2020-07-02 01:11:57+00:00,"Facts First: Based on available data, Patrick is wrong to suggest that Texas didn't skip over anything when it decided to reopen. When Texas reopened on May 1, the state was not in accordance with the criteria outlined by the WH coronavirus task force. https://t.co/f6b7dlCmOS",False,CNN,48997540,1109,False
1278494886430478338,2020-07-02 01:05:08+00:00,Some Latin American countries are seeing shocking unemployment figures as the United Nations warns that the pandemic has caused hunger to rise in the region https://t.co/FnTQQSFP80,False,CNN,48997540,1109,False
1278494384242208769,2020-07-02 01:03:09+00:00,"Several Republican senators blasted the House-passed Washington, DC, statehood bill, calling the legislation unconstitutional and a ""Democratic power grab"" that would ""empower the most radical agenda in modern American politics"" https://t.co/T5JGcaOh5l",False,CNN,48997540,1109,False
1278494161327579136,2020-07-02 01:02:15+00:00,"The Democratic mayor of Richmond, Virginia, invoked his emergency powers to remove multiple Confederate monuments in the city, including a statue honoring Confederate Gen. Thomas ""Stonewall"" Jackson, from the city's historic Monument Avenue https://t.co/avC0CwEWEP",False,CNN,48997540,1109,False
1278493974022352896,2020-07-02 01:01:31+00:00,"Last month, women's flag football became a collegiate sport.

This week, the NFL announced that 15 colleges have already committed to starting programs. The sport will create new full scholarship opportunities for women who'll begin to compete next spring. https://t.co/z2i9WwxtKB",False,CNN,48997540,1109,False
1278492515755339776,2020-07-02 00:55:43+00:00,"""Congress cannot afford to let this moment pass.""

The Business Roundtable, a trade group representing the CEOs of the country's biggest companies, is calling on Congress to commit to passing bipartisan policing reform before the August recess https://t.co/779vPcYy44",False,CNN,48997540,1109,False
